rank,track,blocker_ids,current_state,next_task_id,next_action,entry_condition,acceptance_signal,hard_stop,no_go_guardrails,documentation_required
1,wall_test_section_tswfc2,predictive-wall-test-section-submodels,"AGENT-553 Salt 2 four-node TSWFC2 smoke passed; external Fluid row impl-2026-07-20-fluid-umx1-tswfc2-smoke-followup is completed and registered narrow TSWFC2/combined smoke campaigns",AGENT-557,"Build and run bounded TSWFC2 nominal scorecard from the existing four-node setup; compare to M3 and prior wall/source candidates","preflight passes; Fluid row completed; source/property labels available or missing rows declared as release gates","eligible nominal roots accepted; runtime-input audit pass; source/property strict gate pass; mdot/TP/TW/all-probe gates do not regress versus M3 and best prior wall/source candidate; TW5/TW6 localization improves or is no worse","any rejected train root, forbidden runtime input, source/property strict failure on an admission row, missing Salt1 adapter silently omitted, or mdot-only improvement","no broad grid; no tuning after seeing holdout/score-only rows; no CFD mdot; no realized wallHeatFlux; no imposed CFD cooler duty; no validation TP/TW runtime input; no admission without coupled thermal gates","status; journal; import manifest; package README; runtime audit; root status; coupled scorecard; candidate admission review; source/property gate report; forward map update"
2,umx1_intake,predictive-wall-test-section-submodels;upcomer-onset-data-sparsity,"External Fluid row completed UMX1 bracket/root handling and setup-only reservoir stratification ledgers, but Ethan-side admission status is not yet reviewed",AGENT-558,"Ingest completed external Fluid UMX1 artifacts and decide scorecard-ready, blocked, or superseded by TSWFC2 evidence","external Fluid source/status paths exist and are read-only; no Ethan-side Fluid edits needed","API/root audit, conservation ledger review, root table, and runtime audit produce a clear next decision; no mdot-only path","missing completed Fluid artifact, rejected roots in declared train smoke, conservation failure, or any runtime leakage","do not launch UMX1 grid until accepted-root smoke behavior is clean; do not tune wall loss, HTC, friction, source, or sensor policy to mimic mixing","status; journal; import manifest; package README; UMX1 decision JSON; forward map update"
3,upcomer_onset_design,upcomer-onset-data-sparsity,"Current evidence has recirculating rows but no non-recirculating or near-onset anchors fit-admissible for ordinary coefficients",AGENT-559,"Prepare near-onset/non-recirculating anchor design and compute contract only","design-only row claimed; no scheduler launch authority required","matrix names Q/Re/insulation cases, reverse-flow metrics, pressure/thermal extraction needs, mesh/time UQ, and admission gates","proposal lacks same-window metrics or silently promotes recirculating rows","no ordinary Nu/f_D/K fitting from recirculating rows; no compute launch from design row","status; journal; import manifest; package README; launch/no-launch decision; forward or pressure map update"
4,f6_two_tap_nonrecirc,two-tap-corner-lower-right-component-isolation-fails;two-tap-corner-lower-right-same-qoi-uq-missing;two-tap-corner-lower-right-material-reverse-flow;f6-friction-re-correction,"July 20 nonrecirc anchor plan selected conditional Salt4 high-heat/no-recirculation same-topology future lane; current Salt2/Salt3/Salt4 corner_lower_right rows remain diagnostic",AGENT-560,"Stage non-recirculating pressure-anchor sampling only after terminal source cases and a compute/postprocess row are claimed","source cases terminal and candidate CAND-001 or successor passes source/path readiness","finite endpoint pressure/velocity/temperature/density/flux/area plus reverse-flow and same-QOI UQ gates","component isolation remains failed, reverse flow high, same-QOI UQ missing, or endpoint data invented","no F6 fit; no component-K admission; no K clipping; no hidden multiplier; no scheduler action without separate row","status; journal; import manifest; package README; endpoint contract; UQ report; pressure map update"
5,source_property_gate,source/property scorecard gate,"AGENT-554 promoted reusable source_property_gate.py; scorecard-like admission rows now need strict source/property labels",AGENT-557_PLUS_ALL_SCORECARD_TASKS,"Run source_property_gate.py --strict before any scorecard/admission closeout","scorecard-like CSVs exist or manifest explicitly declares no_scorecard_outputs true","no fit/admission candidate row has missing/blank/blocked source-property labels","strict gate failure on admission row","do not suppress warning unless no scorecard outputs exist; no admission with refresh-required labels","include source_property_gate_report.csv and manifest label status in every scorecard package"
