gate,status,evidence,current_count,required_before_execution,decision_effect
setup_uq_train_only_smoke,pass,"baseline accepted 3/3 and variants accepted 33/33 in train-only setup-UQ terminal package",3,"none for preflight; execution still requires source/property gates",candidate_contract_can_use_setup_uq_as_diagnostic_context
salt14_source_property_release,fail_closed,"predictive source/property exact-field recovery reports release_ready rows 0/4",0,"row-specific setup q/source terms; cp/mu/k mode; strict source-envelope pass; wall/profile conservation; provenance labels",blocks_coefficient_execution
s13_same_label_coarse_gci,fail_closed,"same-label coarse/GCI unlock reports 0 criteria pass rows and 0 formal GCI-ready QOIs",0,"same-label or admitted-equivalent coarse/medium/fine triplets with Qwall/source-side distinction",blocks_qwall_or_exchange_release
passive_h2_numeric_q_loss_release,fail_closed,"PASSIVE-H2 split conflict resolution reports numeric q-loss release rows 0 and candidate admission rows 0",0,"runtime implementation and release gate after split-consistent source/provenance decision",blocks_passive_h2_candidate_admission
passive_h2_runtime_operator,pending_separate_row,"corrected operator predictive train packet says runtime implementation worth launching; current radiation_on is no-op",0,"complete TODO-PASSIVE-H2-OUTER-INSULATION-RADIATION-RUNTIME-IMPLEMENTATION-2026-07-22",blocks_use_of_corrected_radiation_in_execution
mf17_wall_core_exchange_uq,diagnostic_only,"MF17 same-QOI UQ executed but heat-flow match-ready rows are 0",0,"residual-complete same-basis heat-flow match or formal Qwall/source-side release",blocks_exchange_coefficient_admission
protected_split_lock,pass,"CFD run/QOI split chart keeps Salt1-4 nominal as train and Salt2 +/-5Q plus val_salt2 as holdout_test/external_test subtype",4,"freeze manifest before any protected scoring",prevents_validation_holdout_external_scoring_now
candidate_freeze,fail_closed,"no upstream candidate has source/property, Qwall/passive, pressure, and split gates all passed",0,"exactly one runtime-legal candidate with frozen coefficients and leakage audit",keeps_S11_S15_S6_closed
