span_name,hydraulic_classification,field_row_count,case_usable_fraction_mean,case_usable_fraction_min,mean_abs_delta_t_wall_bulk_k,case_min_abs_delta_t_wall_bulk_mean_k,case_min_abs_delta_t_wall_bulk_min_k,mean_nu_local_signed,enthalpy_residual_mean,enthalpy_residual_min,enthalpy_residual_max,enthalpy_sign_consistency_fraction,phase1_thermal_classification,phase1_thermal_reason
left_lower_leg,excluded,23040,0.6140625,0.475,0.4883851634856165,0.0006053495732345482,0.0002839990565348671,6.122139041439791,1.2792033649589438,0.023723308423400053,3.0637773097582244,0.5,blocked_hydraulic_exclusion,hydraulic branch is already excluded in the water evidence subset
left_upper_leg,contextual_only,25920,0.9972222222222222,0.9888888888888889,0.7595977841708937,0.2132562800622395,0.1416263880625479,6.444589936925568,0.5036130242265009,0.01077982205251448,1.3569815973131512,1.0,closure_rebuild_candidate,thermal support exists and closure is moderate enough for the next rebuild pass
lower_leg,contextual_only,1040,0.46153846153846156,0.46153846153846156,4.203027402321205,0.7171069452101619,0.5794403299890973,12.18438460348321,0.3848646303961629,0.31765116898043416,0.45906684270087084,1.0,blocked_by_support_or_closure,"thermal support fraction, delta-T support, or closure consistency is too weak"
right_leg,water_family_candidate,1000,0.16,0.16,0.989284114092531,0.5735947076081089,0.34846741742865106,4.455835294350648,8.222442776152263,6.535463001200012,9.190706015830713,0.2777777777777778,blocked_by_support_or_closure,"thermal support fraction, delta-T support, or closure consistency is too weak"
test_section_span,water_family_candidate,19440,1.0,1.0,1.070048686954317,0.30215753342822893,0.20946837370144067,9.771944749745577,2.4612498755544716,1.3872984268907316,3.3516475452431385,0.0,closure_rebuild_priority,thermal support is strong but enthalpy-vs-wall sign consistency is poor
upper_leg,water_family_candidate,47640,0.8740134340890009,0.8293870696893367,2.275687605325421,9.756426815954455e-05,1.15844938477494e-05,12.131999571767821,1.9545780836716546,1.8385343011571205,2.0519451714364565,0.0,blocked_by_support_or_closure,"thermal support fraction, delta-T support, or closure consistency is too weak"
