segment_id,model_region,fluid_walls_role,geometry_status,material_stack_status,pressure_model_status,thermal_circuit_status,source_sink_role_status,boundary_layer_state_status,recirculation_flags_status,uncertainty_status,runtime_input_status,primary_blocker,next_required_artifact,evidence_summary,source_paths
lower_leg_heater,lower_leg,heated lower incline; primary heat-source region,admitted,partial,diagnostic,diagnostic,partial,diagnostic,diagnostic,partial,setup geometry and heater role are legal; realized wallHeatFlux and internal-Nu diagnostics are scoring-only,"source/sign heat-balance, branch-local recirculation, and same-QOI GCI gates have zero admitted heater rows","source-owned heater fluid-fraction or wall-circuit row with sign/enthalpy review, low-recirculation mask, and same-QOI mesh/GCI","Geometry and heater role are established, but heater Internal-Nu/UA fitting is not admitted.",reference/geometry_reference.md;work_products/2026-07/2026-07-16/2026-07-16_heater_lower_leg_source_sign_gci_admission/README.md;work_products/2026-07/2026-07-16/2026-07-16_pressure_ladder_harvest_admission_table/README.md;work_products/2026-07/2026-07-13/2026-07-13_predictive_heat_loss_path/README.md
left_lower_leg_upcomer,left_lower_leg,lower upcomer subspan before bare-quartz test section,admitted,partial,diagnostic,diagnostic,partial,diagnostic,diagnostic,partial,"ordinary single-stream Nu, f_D, and K are forbidden; future hybrid/onset lane may consume setup inputs plus admitted recirculation features",material recirculation invalidates ordinary single-stream pressure and thermal coefficients,"upcomer hybrid model with same-window reverse area/mass fraction, wall-core Delta T, Gz, pressure residual movement, and mesh/time uncertainty","Upcomer recirculation is observed and useful as an exclusion/admission flag, not a predictive closure.",reference/geometry_reference.md;work_products/2026-07/2026-07-16/2026-07-16_recirc_feature_admission_and_hybrid_contract/README.md;work_products/2026-07/2026-07-16/2026-07-16_recirc_feature_admission_and_hybrid_contract/hybrid_1d_model_contract.csv;work_products/2026-07/2026-07-16/2026-07-16_pressure_ladder_harvest_admission_table/README.md
test_section_span,test_section_span,bare-quartz electrically heated upcomer subspan; currently net heat sink in mainline evidence,admitted,admitted,diagnostic,partial,partial,diagnostic,diagnostic,partial,"setup-only TS role rows pass runtime audit, but no TS candidate is admitted for held-out coupled scoring",M3+TS heat-loss validation and holdout gates fail or the coupled solve gate is incomplete,frozen setup-only test-section loss candidate that passes Salt3/Salt4 heat-loss and coupled mdot/TP/TW gates,"Geometry, quartz material stack, and equation form are established; predictive net source/sink magnitude remains partial.",reference/geometry_reference.md;operational_notes/07-26/16/2026-07-16_fluid_walls_steady_1d_model_form.md;work_products/2026-07/2026-07-16/2026-07-16_coupled_m3ts_test_section_scorecard/README.md;work_products/2026-07/2026-07-16/2026-07-16_recirc_feature_admission_and_hybrid_contract/hybrid_1d_model_contract.csv
left_upper_leg_upcomer,left_upper_leg,upper upcomer subspan after test section,admitted,partial,diagnostic,diagnostic,partial,diagnostic,diagnostic,partial,"ordinary single-stream Nu, f_D, and K are forbidden; use only hybrid/onset diagnostics until admitted",recirculating/effective-lane status blocks ordinary pressure and thermal coefficient fitting,"same upcomer hybrid/onset artifact as left_lower_leg, with outlet-plane reverse fraction and uncertainty",The segment is geometrically admitted but belongs to the recirculating upcomer effective lane.,reference/geometry_reference.md;work_products/2026-07/2026-07-16/2026-07-16_recirc_feature_admission_and_hybrid_contract/README.md;work_products/2026-07/2026-07-16/2026-07-16_recirc_feature_admission_and_hybrid_contract/hybrid_1d_model_contract.csv;work_products/2026-07/2026-07-16/2026-07-16_pressure_ladder_harvest_admission_table/README.md
upper_leg_cooler_hx,upper_leg,cooler/HX upper branch and passive external-loss region,admitted,partial,diagnostic,partial,partial,diagnostic,diagnostic,partial,HX/cooler duty may use setup-only model parameters; imposed CFD cooler duty and realized wallHeatFlux remain forbidden at runtime,cooler/HX model is first-order but not a complete admitted segment thermal circuit with mesh/time uncertainty,direct Fluid UA/effectiveness row or held-out HX score tied to wall/material stack and segment uncertainty,"Cooler sink role and HX candidate forms exist, but the segment-local wall/HX circuit is not fully admitted.",reference/geometry_reference.md;work_products/2026-07/2026-07-13/2026-07-13_predictive_hx_fit/README.md;work_products/2026-07/2026-07-13/2026-07-13_predictive_heat_loss_path/README.md;work_products/2026-07/2026-07-14/2026-07-14_boundary_hx_wall_radiation_model_form_decision/README.md
right_leg_downcomer,right_leg,right vertical return/downcomer; passive loss and buoyancy return region,admitted,partial,diagnostic,diagnostic,partial,diagnostic,diagnostic,partial,passive external-boundary setup fields are legal; downcomer Nu/UA fit is not admitted,"sign/enthalpy, low-recirculation validity, same-QOI GCI, and lit-review absorption gates fail",new downcomer same-QOI thermal extraction/GCI after sign/enthalpy and interface-recirculation policy are repaired or rejected,"Geometry is strong, but current downcomer thermal coefficient evidence is blocked by policy and interface-quality failures.",reference/geometry_reference.md;work_products/2026-07/2026-07-16/2026-07-16_downcomer_policy_admission_artifact/README.md;work_products/2026-07/2026-07-13/2026-07-13_predictive_heat_loss_path/README.md;work_products/2026-07/2026-07-16/2026-07-16_pressure_ladder_harvest_admission_table/README.md
junction_stub_connector_group,junction_other,zero-length or short connector/junction thermal and pressure-loss regions,partial,partial,diagnostic,diagnostic,partial,missing,diagnostic,missing,aggregate junction loss may guide model structure; local realized wallHeatFlux is not a runtime input,"junction/stub loss is aggregate role-level evidence, not split by physical junction with admitted area/material/pressure/thermal ownership","split lower-left/lower-right/upper-right/upper-left junction heat and pressure evidence with local areas, BCs, and uncertainty","Junction/stub losses are physically important and persistent, but local circuit and K terms are not admitted.",work_products/2026-07/2026-07-16/2026-07-16_pressure_loop_plot_and_cfd_heat_audit/heat_audit_and_modeling_recommendations.md;work_products/2026-07/2026-07-16/2026-07-16_pressure_ladder_harvest_admission_table/README.md;operational_notes/07-26/15/2026-07-15_segment_resolved_pressure_thermal_modeling_plan.md;work_products/2026-07/2026-07-14/2026-07-14_boundary_hx_wall_radiation_model_form_decision/README.md
