waterfall_step,sensor,segment,mean_m3_abs_error_K,mean_prior_candidate_abs_error_K,mean_prior_candidate_excess_vs_m3_K,prior_candidate_families_failed,fail_fraction,owner_inference,required_physics,admission_status
S12-RES-TW5,TW5,heated_incline,7.268349056,54.662703,47.39435394,8,1,heated_incline_upcomer_exchange_shape,energy-conserving upcomer/heated-incline stratification or exchange state; not another passive hA selector,not_admitted
S12-RES-TW6,TW6,heated_incline,5.138559631,46.8165631,41.67800347,8,1,heated_incline_upcomer_exchange_shape,energy-conserving upcomer/heated-incline stratification or exchange state; not another passive hA selector,not_admitted
PASSIVE-H2-CAND001,TW5/TW6,passive_wall_external_boundary,,,,,,broad passive h and fixed-state q estimates sit inside engineering screens,"current h and fixed-state q estimates are inside broad engineering screens, but passive h provenance remains wallHeatFlux-derived and ambient/geometry basis is not source-released",source_basis_not_released
SETUP-KNOWN-HEATER-SOURCE,TW5/TW6,lower_leg_setup_heater_source_lane,,,,,,source lane is executable and setup-known for Salt2 train/support,TW4/TW5 worsen and only TW6 improves,partial_local_diagnostic_not_candidate
EMPIRICAL-LEG-BIAS,TW5/TW6,diagnostic_empirical_residual_layer,,,,,,train-only residual envelope shows large reducible bias,coefficients are empirical and nonphysical; no source/property release,diagnostic_only_not_physical_candidate
