evidence_need,why_needed,acceptable_source,minimum_gate,thesis_use_if_missing
signed_local_exchange_direction,Current pairwise and parent-cell forms lacked a source-grounded directionality rule,CFD sampled fields or same-QOI source-side exchange diagnostics near upcomer/test-section bridge,Sign and magnitude stable under same-QOI temporal UQ and same-label mesh/GCI,State AMX1 directionality remains unresolved and diagnostic-only.
wall_core_stratification_shape_near_TW5_TW6,AMX1 regressions suggest the residual is not solved by scalar axial diffusion alone,Resolved wall/core temperature profiles around heated incline and upcomer shoulder,Profiles identify where exchange should be active while keeping validation temperatures as forbidden runtime inputs,Use D3/S12 residual ownership as evidence that wall shape is missing.
source_bounded_exchange_envelope,Multiplier-only tests are not admissible fitting evidence,Setup-only geometry material property and heat-source envelope independent of target residuals,Predeclared multiplier or coefficient bounds before smoke run,Report no source/property release for AMX1.
same_label_mesh_gci_for_s13_exchange_qois,Current S13 production use remains blocked by absent exact-label medium/fine rows,S13 same-label coarse medium fine QOI generation and GCI package,Accepted same-label mesh/GCI for Q_wall_W exchange proxy tau proxy and wall-core contrast,Keep S13 exchange rows as diagnostic thesis evidence only.
paired_progression_gate,AMX1 must not improve one owner while worsening TP/TW/all-probe residuals,Predeclared Salt2 smoke with disabled baseline and one source-bounded AMX1 form,Finite roots conservative ledger and nonpositive mdot TP TW all-probe deltas,Do not freeze or validate an AMX1 candidate.
