criterion,necessity,auditable_acceptance_text,current_status,current_evidence_or_gap,admission_effect_if_satisfied
qoi_label_formula_sign_units,required,"same formula, units, positive direction, clipping convention, and no source-side/Qwall relabel",not_admitted_currently,"current rows state formula/sign basis, but no audited joined triplet contract exists",can consider coarse-equivalent triplet only after all required criteria pass
geometry_mask_provenance,required,"same topology-derived CV, exchange interface, wall/core band, face areas, and normals at each mesh",not_admitted_currently,medium/fine masks are mesh-level sampler masks; current coarse is reconstructed from prior topology packages,can consider coarse-equivalent triplet only after all required criteria pass
time_window_equivalence,required,same physical window role or documented terminal-equivalence map with source roots and sampled fields,not_admitted_currently,coarse windows are continuation retained windows; medium/fine terminal windows are not strict same-time companions,can consider coarse-equivalent triplet only after all required criteria pass
field_source_property_basis,required,"same OpenFOAM field source basis, property basis, and pressure/velocity basis for the QOI",not_admitted_currently,source/property and cp/viscosity releases remain separate gates,can consider coarse-equivalent triplet only after all required criteria pass
closed_or_residual_accounted_cv,required_for_admission,"all open-boundary advective, exchange, wall, source/sink, storage, and residual terms explicit",not_admitted_currently,"open-CV diagnostics exist, but no production energy residual is closed on the same basis",can consider coarse-equivalent triplet only after all required criteria pass
same_qoi_uq_and_mesh_disposition,required,same-QOI temporal UQ plus mesh/GCI or accepted mesh-spread disposition on the exact labels,partially_available_diagnostic,temporal UQ exists and Q_wall_W medium/fine spread is low; formal GCI and proxy stability fail closed,can consider coarse-equivalent triplet only after all required criteria pass
