model_family,evidence_rows_reviewed,eligible_rows,admitted_rows,decision,reason,next_gate
ordinary_single_stream_developing_fD_Nu,18,12,0,precheck_only_no_fit,source envelope and same-QOI UQ remain missing; recirculation invalidates many spans,branch-local same-QOI UQ plus source/property labels
throughflow_recirc_exchange_cell,18,6,0,diagnostic_architecture_only,S13 exchange evidence remains diagnostic; exact same-label mesh/GCI and source release are missing,post-sampler same-label GCI production harvest gate
section_or_cluster_pressure_K,18,0,0,pressure_basis_required_no_component_K,"pressure rises and corner rows need hydrostatic, kinetic, straight/developing, recovery, and residual decomposition",low-recirculation F6/source recovery anchors after terminal evidence
signed_flow_junction_network,18,0,0,not_current_primary_mode,"current evidence emphasizes local reverse area/mass with net throughflow, not admitted negative net branch flow",signed path evidence only if topology shows discrete branch reversal
internal_Nu_fit,18,0,0,closed_to_fitting,"heat residual, passive loss, radiation, storage, and recirculation owners are not separable enough for Nu admission",conservative thermal ledger plus source-bounded release and same-QOI UQ
