priority,owner_lane,action_id,action,inputs,outputs,acceptance,blocked_by,can_start_now
P1,therm-reconstr,run_compute_node_matched_plane_sampling,Execute or finish the compute-node matched upcomer inlet/mid/outlet sampling workflow from AGENT-341/344.,AGENT-339 extraction contract; AGENT-341 sampling targets; admitted terminal case paths,"Admission-grade reverse area/mass fractions, secondary velocity fraction, bulk T, wall T, wallHeatFlux, Re/Pr/Ri/Ra/Gr/Gz, plane/time metadata","Every row uses geometric normals, face areas, matched wall/fluid station bands, and exact time windows; proxy-only rows remain marked diagnostic.",compute-node sampling not terminal in this package; active AGENT-344 owns implementation,yes_active_elsewhere
P2,cfd-pp,harvest_corrected_q_terminal_rows,"Monitor and harvest corrected-Q jobs, then run terminal steady/admission and recirculation extraction gates.",AGENT-342 job submissions; corrected-Q solver logs; AGENT-343 run steady-state table,Admitted or rejected corrected-Q candidate rows with terminal status and onset metrics,No row is used for onset/Nu until terminal harvest and admission verdict are recorded.,scheduler terminal state and postprocessing completion,yes
P3,internal-Nu,rebuild_nu_admission_from_extracted_metrics,Re-run the Nu admission decision after matched-plane metrics and corrected-Q admission land.,Matched-plane metric table; corrected-Q/target-Re admission table; residual ownership ledger,Updated diagnostic/validation/fit-admissible Nu decision table,Fit reopens only with at least three admitted single-stream rows including a non-recirculating ordinary-pipe anchor and near-transition or higher-Re row.,P1 and usually P2,no
P4,mesh/GCI,build_closure_qoi_gci_failed_gate_matrix,Convert closure-QOI mesh/GCI blocker into per-QOI failed gates and next evidence rows.,Thermal mesh gate refresh; repaired/smoke outputs; blocker ledger,QOI-by-QOI mesh/GCI admission matrix,"No smoke row is admitted unless sign, heat balance, triplet, monotonicity/oscillation, and policy gates pass.",none for diagnostic matrix; fit/publication rows need future evidence,yes
P5,BC-modeling,define_boundary_model_task_matrix,"Build setup-side task matrix for HX/cooler, heater/source, wall-layer/passive loss, storage, and radiation semantics.",Boundary residual guardrails; forward-v1 gate; thermal parity roadmap,"Boundary model tasks with required inputs, forbidden runtime leakage, and acceptance tests","Every thermal residual lane has an owner, setup/calibration/validation classification, and Nu exclusion rule.",none for contract; Fluid implementation needs separate claim,yes
P6,Fluid; BC-modeling,implement_external_boundary_dictionary_api,Add first-class Fluid support for external h/Ta/Tsur/emissivity/layer dictionaries and drive-temperature selectors.,Fluid external boundary API task; boundary/radiation semantics,Fluid API and tests for external boundary replay/prediction without double-counted radiation,Requires explicit board claim over external ../cfd-modeling-tools before edits.,external repo ownership claim,claim_required
P7,hydraulics,rerun_f6_after_admitted_re_variation,Evaluate F6_phi_re only after admitted Re-variation pressure-loss rows exist.,Admitted corrected-Q/target-Re rows; hydraulic reset/K contract,F6 pressure-loss scorecard with mdot guardrails,Thermal Nu is not used to compensate hydraulic residuals.,P2 or targeted-Re CFD admission,no
