term_family,source_table,n_rows,n_fit_target_or_fit_safe,n_included_in_h1_proxy,n_recirculation_flagged,status_in_h1_scorecard,notes
straight_friction_pressure_gradient,work_products/2026-07/2026-07-13/2026-07-13_predictive_hydraulic_gate/hydraulic_fit_safety_gate.csv,6,2,0,0,guardrail_only_not_proxy_K,Raw pressure-gradient friction remains separate from named K; only left_lower_leg and left_upper_leg are fit-safe with mesh caveats.
straight_section_named_loss,work_products/2026-07/2026-07-13/2026-07-13_litrev_reset_named_losses/named_pressure_loss_table.csv,3,3,0,0,kept_separate_not_in_aggregate_K,Straight-section rows are not hidden inside the proxy K sum.
component_K,work_products/2026-07/2026-07-13/2026-07-13_litrev_reset_named_losses/named_pressure_loss_table.csv,0,0,0,0,not_present_as_distinct_rows,The available named-loss table carries branch_apparent and cluster_K rows; no distinct component_K rows are exported yet.
cluster_K,work_products/2026-07/2026-07-13/2026-07-13_litrev_reset_named_losses/named_pressure_loss_table.csv,15,0,0,6,diagnostic_named_loss_not_included_in_proxy,Cluster K rows stay visible; current H1 proxy did not include them because only finite Salt2 fit-target K_local branch rows were summed.
branch_apparent_loss,work_products/2026-07/2026-07-13/2026-07-13_litrev_reset_named_losses/named_pressure_loss_table.csv,15,9,3,6,aggregate_fixed_K_proxy_source,Only Salt2 finite fit-target branch_apparent K_local rows feed the aggregate proxy K=40.6384.
reset_development,work_products/2026-07/2026-07-13/2026-07-13_litrev_reset_named_losses/reset_distance_map.csv,33,33,0,12,diagnostic_reset_context_not_fitted,Reset/development rows explain candidate structure but were not fit as a thermal or global friction multiplier.
momentum_corrected_profile_or_debuoying,work_products/2026-07/2026-07-13/2026-07-13_predictive_hydraulic_gate/hydraulic_fit_safety_gate.csv,6,6,0,0,diagnostic_only_not_training_K,Momentum-corrected rows remain profile/debuoying diagnostics; not used to hide errors in one friction multiplier.
recirculation_diagnostics,work_products/2026-07/2026-07-13/2026-07-13_litrev_reset_named_losses/named_pressure_loss_table.csv,6,0,0,6,excluded_from_fit_and_proxy,Recirculating spans remain diagnostic and are not reduced to single-stream K or friction coefficients.
