claim_id,support_level,allowed_train_claim,validation_claim,holdout_claim,external_test_claim,blocked_or_forbidden
fluid_runtime_external_bc_mechanism,implemented_and_smoked,one salt_2 train/support upcomer ambient row loaded and heat-accounted,none,none,none,"full solver score, TP/TW prediction, final admission"
same_qoi_uq_gate,negative_gate_result,phase table exists,0 accepted rows,0 accepted rows,none,closure and coefficient admission
thermal_residual_ownership,diagnostic_negative_result,S8 atlas and heat-path ownership tables ready,0 admitted candidate rows,none,none,wall candidate admission and final score
recirculation_guard_and_upcomer_exclusion,diagnostic_negative_result,onset/exchange evidence documented,0 exchange coefficient admissions,none,none,ordinary upcomer closure admission
pressure_residual_ownership,diagnostic_negative_result,candidate/gate rows documented,0 admitted rows,none,none,"component K, cluster K, F6 fit, clipped K, hidden multiplier"
