claim_id,potential_claim,status,allowed_scope,required_caveat,blocked_reason_if_any
X01,Cross-family hydraulic branch dependency on left_lower_leg,blocked_by_excluded_hydraulic_branch,none,Both Water left_lower_leg hydraulic rows are now exclusions from the evidence subset rather than usable dependencies.,Cross-family hydraulic left_lower_leg fitting remains blocked because the only Water evidence for that branch is excluded.
X02,Cross-family effective thermal dependency on left_lower_leg,blocked_by_thermal_support_limits,none,Water left_lower_leg rows fail the current Delta T and usable-fraction gates.,Water-family left_lower_leg effective thermal metrics are denominator-limited and blocked.
X03,Cross-family test_section effective thermal comparison,allowed_with_caveats,support-structure comparison only,"Water test_section_span is supporting-only, not headline-safe.",
X04,Cross-family branch support asymmetry between Salt and Water,allowed,method and interpretability discussion,"Discuss support-gating asymmetry, not fitted coefficient superiority.",
X05,Cross-family momentum-resistance fit target,blocked,diagnostic consistency check only,Momentum resistance is a proxy that inherits branch exclusions and hydraulic disagreement.,Not a direct closure-quality measurement.
X06,Boundary-layer landmarks as headline cross-family evidence,blocked_by_branch_promotion_boundary,contextual appendix/internal use only,Boundary-layer landmarks remain contextual-only.,Scrutiny package does not promote any boundary-layer row to paper-safe headline use.
X07,Salt-only safe-subset thermal dependency,allowed_with_caveats,"left_lower_leg, test_section_span, left_upper_leg, upcomer",Effective thermal variables remain support-gated and family-specific.,
X08,Water-only left-side branch thermal dependency,blocked_by_thermal_support_limits,none,Water left_lower_leg and upcomer remain support-limited.,Current Water left-side branches fail the current Delta T and usable-fraction gates.
