claim_id,claim_text,status,evidence_path,caveat
A1,A frozen low-DOF empirical bias layer can reduce CFD-ROM temperature residuals by roughly an order of magnitude,allowed_for_Track_A,work_products/2026-07/2026-07-21/2026-07-21_fluid_reduced_dof_bias_transfer_screen/transfer_summary.csv,Report as empirical ROM/discrepancy performance not physical closure admission
A2,F2_global_affine is the recommended thesis-facing empirical ROM because it is nearly as accurate as F5 with two degrees of freedom,allowed_for_Track_A,work_products/2026-07/2026-07-22/2026-07-22_fluid_empirical_bias_models_publication_report/report.md,F5 remains the best numerical upper-bound result
A3,Salt3/Salt4 transfer stress rows test frozen empirical coefficients without refitting,allowed_with_label,work_products/2026-07/2026-07-21/2026-07-21_fluid_reduced_dof_bias_transfer_screen/split_metric_scorecard.csv,Do not call these rows final external-test validation
B1,The strict predictive model must use setup-known runtime inputs and source-released coefficients,allowed_for_Track_B,reports/thesis_dossier/Chapters_and_sections/current/08_thesis_claim_ledger.md,This stricter track may underperform or remain blocked
B2,P1D/PASSIVE-H2 is the leading strict physical candidate lane but is not frozen,allowed_for_Track_B,work_products/2026-07/2026-07-22/2026-07-22_p1d_bulk_cv_h2_train_only_thesis_prototype/README.md,No protected final scores or coefficient release
B3,The final M6 predictive scorecard remains blocked with zero final score values,allowed_for_Track_B,work_products/2026-07/2026-07-22/2026-07-22_predictive_model_blocker_burndown/README.md,Blocked scorecard is a defensible result not a failed thesis
X1,The empirical bias coefficients are admitted heat-transfer coefficients,forbidden,work_products/2026-07/2026-07-22/2026-07-22_fluid_empirical_bias_models_publication_report/report.md,They are mathematical discrepancy parameters unless later source-released
X2,The empirical track and strict predictive track are the same claim,forbidden,work_products/2026-07/2026-07-23/2026-07-23_thesis_two_track_rom_model_writeup/thesis_model_writeup.md,Keep digital-twin calibrated ROM usefulness separate from physical predictive admission
