rank,model_form_to_try,reason,required_gates_before_claim,allowed_now,expected_thesis_use,admission_status
1,M0 setup-only baseline,A real lower-bound prediction is still missing and is cheap relative to CFD/postprocessing.,runtime-input audit; source/property labels; locked split shell,builder/specification only; no final score unless predictions are actually generated,baseline figure/table for all later model forms,not_scored_yet
2,M5 / MF-04 throughflow-plus-recirculation exchange cell,"S13 now has finite recirculation volume, exchange proxy, sampled-field trends, and source-side heat context.",exact Qwall or source-side QOI decision; pressure basis; same-QOI UQ; no source-side relabel as Q_wall,diagnostic figures and gate table only,upcomer recirculation model-form contribution,diagnostic_only_until_Qwall_UQ_harvest_release
3,MF-02 section-effective pressure residual / two-tap,The lower-right corner pressure result is a clean negative component-K case and a useful section-effective pressure figure.,same-QOI UQ and nonrecirculating/low-reverse anchor before any coefficient admission,no-fit diagnostic transfer and signed residual figures,pressure model-form negative result,not_admitted
4,MF-01 ordinary gated single-stream branch on right_leg/test_section_span,S14 labels right_leg and test_section_span as preferred future ordinary F6 lanes.,endpoint pressure/velocity fields; ordinary-flow RAF/RMF checks; same-QOI UQ; source-property release,planning and readiness table only,future ordinary-pressure lane if gates pass,future_candidate
5,M2 passive wall/test-section physical-basis repair,"Heater/cooler terms are comparatively mature, while passive wall/test-section residual ownership blocks full prediction.",physical source basis; no global hA multiplier; train-only ablation; source/property labels,train-only residual-owner ablation after active gate packages close,thermal negative/repair study,blocked_pending_source_basis
6,M6 final frozen candidate,"This is the endpoint, but S6 currently publishes zero final score values.",exactly one runtime-legal candidate from S13/S14/thermal residual gates plus S11/S15 source-property release,blocked shell only,final scorecard only after freeze,blocked_no_frozen_candidate
