task_id,lane,model_component,next_task_name,purpose,setup_only_runtime_inputs,fitted_parameters,validation_targets,diagnostic_only_cfd_quantities,repo_local_or_fluid_api,implementation_status,split_policy,no_runtime_cheat_guardrail,radiation_semantics,recommended_priority,acceptance_gate,primary_sources
BCM-HEATER-FRACTION-V1,heater_realized_fraction,heater and test-section source,"Repo-local heater fraction / test-section external-loss screen","Replace current 37 W test-section fluid-source assumption with a setup-only heater source contract and one optional calibrated scalar.","heater setup power; test-section setup power; declared source-contract mode; property lane; case geometry; no CFD wallHeatFlux at runtime","Primary next run uses eta_heater=1, test_section_fluid_fraction=0, test_section_external_loss_W=0; optional train-only scalar is either eta_heater or test_section_external_loss_W, never both on current three-row split","Salt3 validation and Salt4 holdout branch/sensor/Tmean errors; Salt2 train only for optional scalar; mdot tracked as guardrail not thermal fit target","realized heater wallHeatFlux; realized test-section wallHeatFlux; diagnostic equivalent eta_heater=0.918 mean; diagnostic external loss magnitude; CFD Tmean used only for scoring","repo_local","next_executable_recommended","salt_2=train; salt_3=validation; salt_4=holdout","Do not use realized CFD wallHeatFlux, CFD Tmean, or CFD cooler duty as runtime inputs; use them only for declared train fit or validation scoring","No separate radiation term in this source task; keep external loss/radiation in wall/external lane",1,"Run C1 heater-only as default; if calibrating, fit exactly one scalar on Salt2 and report Salt3/Salt4 without refit; reject if validation worsens or parameter sign contradicts setup physics","work_products/2026-07/2026-07-13/2026-07-13_heater_test_section_contract/README.md; candidate_parameters.csv; recommended_model.csv"
BCM-COOLER-HX-UA-V1,cooler_hx_removal,cooler/HX removal,"Fluid direct UA/effectiveness multiplier for predictive HX","Replace imposed CFD cooler duty and post-solve duty multiplier with a setup-only HX model inside Fluid.","air inlet temperature; air flow or air-side boundary inputs; HX geometry/active length; coolant/ambient setup; salt inlet state from solve; property lane","One global UA_multiplier or effectiveness_multiplier around Fluid predictive_airside_hx; fit only on Salt2 initially","cooler removed duty scored against CFD on Salt3/Salt4; Tmean, branch temperatures, TP/TW sensors; mdot as coupled guardrail","CFD cooler_removed_duty_W for train/validation scoring only; realized wallHeatFlux cooler rows; CFD temperature targets","requires_external_fluid_api_edit","blocked_pending_fluid_direct_ua_hook","salt_2=train; salt_3=validation; salt_4=holdout","Do not pass CFD cooler_removed_duty_W as runtime input; only fit scalar on train and compute duty from setup/solver state","If external boundary radiation participates in cooler-adjacent wall loss, represent it through boundary dictionaries, not added to realized CFD wallHeatFlux replay",2,"Fluid exposes direct UA/effectiveness multiplier; train scalar on Salt2; Salt3/Salt4 score without refit; preserve HX0 baseline and HX1 post-solve multiplier as comparison only","work_products/2026-07/2026-07-13/2026-07-13_predictive_hx_fit/README.md; hx_model_forms.csv; hx_fit_parameters.csv"
BCM-WALL-EXT-BC-V1,wall_layer_external_convection,passive wall/external convection and wall-layer drive,"First-class external boundary table for h/Ta/Tsur/emissivity/layers","Represent setup external losses from patch/segment boundary dictionaries instead of replaying realized wallHeatFlux.","segment or patch mapping; h; Ta; Tsur; emissivity; wall/layer resistance; drive-temperature selector; exposed area; property lane","Optional global hA multiplier or wall-layer blend scalar after API exists and train split is declared","passive external heat by segment; branch temperatures; wall/shell diagnostic temperatures; TP/TW sensors","realized passive wallHeatFlux; wall-shell temperature proxies; CFD patch heat ledger; validation sensor temperatures","requires_external_fluid_api_edit","blocked_pending_first_class_boundary_dictionary","salt_2=train for any scalar; salt_3=validation; salt_4=holdout","Do not use realized CFD wallHeatFlux as runtime boundary heat; compute heat from setup boundary dictionary and solver temperatures","Radiation-capable but not double-counted: compute radiation only in predictive boundary mode; disable/separate it for realized wallHeatFlux replay",3,"Fluid consumes external boundary dictionaries and reports separate convection/radiation/wall terms; replay mode proves no double counting; validation rows score without refit","operational_notes/maps/thermal-boundary-and-radiation.md; work_products/2026-07/2026-07-14/2026-07-14_boundary_hx_wall_radiation_model_form_decision/README.md"
BCM-RADIATION-SEMANTICS-V1,radiation_semantics,radiation policy and ledgers,"Radiation-safe replay/predictive mode policy","Prevent double counting and define how radiation enters predictive setup-only boundary models.","emissivity; Tsur; exposed area; view-factor assumption if available; Ta; wall/surface temperature from solve; mode flag replay_vs_predictive","No fitted radiation scalar in first task; later sensitivity may vary emissivity/view factor only with declared source","energy ledger term split; branch temperatures; sensitivity bounds; no separate qr target because none exported","rcExternalTemperature emissivity/Tsur metadata; total CFD wallHeatFlux; OF13 microcase deltas; no exported qr","repo_local_policy_plus_external_api_when_predictive","policy_ready_api_blocked_for_predictive_split","same split as owning wall/HX task; no independent fit on three rows","Never add 1D radiation on top of CFD wallHeatFlux replay; radiation-off is sensitivity, not CFD parity","CFD rcExternalTemperature includes radiative exchange in total wallHeatFlux and no separate qr exists; predictive mode may compute radiation explicitly from setup inputs",4,"Every boundary task declares replay or predictive mode; ledgers state whether radiation is embedded, computed, off-sensitivity, or unavailable; tests reject double-counted mode","operational_notes/maps/thermal-boundary-and-radiation.md; AGENT-314 decision table; rcExternalTemperature publication evidence"
BCM-BOUNDARY-INTEGRATION-V1,integrated_forward_score,boundary submodel integration,"Forward boundary scorecard integration after heater/HX/API gates","Combine admitted heater, HX, wall, and radiation semantics into forward-v1 scoring without violating runtime input discipline.","selected heater contract; selected HX model; selected external boundary dictionary; property lane; hydraulic closure state; validation split","Only previously admitted/calibrated scalars; no new fit in scorecard task","mdot; branch temperatures; TP/TW sensor temperatures; heat-ledger residuals; train/validation/holdout status","all CFD targets are scoring/diagnostic only; no runtime CFD mdot, wallHeatFlux, or validation temperature","repo_local_after_dependencies","blocked_until_BCM_HEATER_and_HX_or_API_gate","salt_2=train; salt_3=validation; salt_4=holdout","Scorecard cannot introduce new fitted boundary parameters; it only consumes admitted model rows","Radiation mode inherited from selected boundary model and audited for no double counting",5,"Forward-v1 boundary scorecard states admitted/scored-but-failing/blocked; fails if required boundary inputs are absent or diagnostic-only CFD terms are runtime inputs","work_products/2026-07/2026-07-14/2026-07-14_forward_model_readiness_after_h1_proxy/README.md; AGENT-314 decision table"
