handoff_family,requirement_id,requirement,required,acceptance_signal,source_path
PASSIVE-H2_outer_insulation_radiation,R1,analytic layer/radiation tests pass,True,unit tests solve conduction plus exterior convection/radiation and recover outer-surface heat balance,work_products/2026-07/2026-07-22/2026-07-22_passive_h2_corrected_operator_predictive_train_packet/implementation_handoff_contract.csv
PASSIVE-H2_outer_insulation_radiation,R2,radiation_on changes heat ledger,True,train-only radiation_on minus radiation_off qambient or radiation lane delta is nonzero and comparable to corrected outer-surface radiation 22-26 W,work_products/2026-07/2026-07-22/2026-07-22_passive_h2_corrected_operator_predictive_train_packet/implementation_handoff_contract.csv
PASSIVE-H2_outer_insulation_radiation,R3,runtime inputs remain legal,True,runtime inputs are limited to setup thermal-boundary fields and model-solved state; forbidden runtime fields remain excluded,work_products/2026-07/2026-07-22/2026-07-22_passive_h2_corrected_operator_predictive_train_packet/implementation_handoff_contract.csv
PASSIVE-H2_outer_insulation_radiation,R4,same-QOI train-only results documented,True,"report mdot, qambient/qhx, TP/TW projection, heat ledger, residual movement for train rows only; protected scoring remains false",work_products/2026-07/2026-07-22/2026-07-22_passive_h2_corrected_operator_predictive_train_packet/implementation_handoff_contract.csv
S13_residual_complete_open_CV,S13-R1,row-specific cp/property release for the same Salt case/window/source basis,True,same-basis enthalpy residual can be computed while forbidden runtime fields remain excluded,work_products/2026-07/2026-07-22/2026-07-22_s13_residual_complete_open_cv_energy_balance_contract/required_input_matrix.csv
S13_residual_complete_open_CV,S13-R2,throughflow enthalpy endpoints and storage/other named residual lanes documented,True,open-CV residual terms are explicit and no residual is absorbed into internal Nu,work_products/2026-07/2026-07-22/2026-07-22_s13_residual_complete_open_cv_energy_balance_contract/required_input_matrix.csv
