convention_id,quantity,sign_or_basis,writer_rule,source_path
SIGN-01,Fluid segment heat balance,"Positive terms heat the fluid; negative terms cool the fluid.","Describe heater/test-section inputs as fluid-positive when they add energy; describe cooler/passive wall as fluid-negative unless a case-specific sign convention says otherwise.",reports/thesis_dossier/Chapters_and_sections/current/17_ch5_csem_fluid_walls_model.md
SIGN-02,Test-section source/loss,"q'_test section to fluid equals electrical deposition minus quartz/external loss.","The test section can be net source or net sink; do not force it to be heat input.",reports/thesis_dossier/Chapters_and_sections/current/17_ch5_csem_fluid_walls_model.md
SIGN-03,Wall loss,"Q_wall loss is positive as loss from fluid when T_drive exceeds external/environment temperature.","If using CFD realized wallHeatFlux, label it diagnostic/target evidence and do not add a second radiation term.",reports/thesis_dossier/Chapters_and_sections/current/17_ch5_csem_fluid_walls_model.md
SIGN-04,Pressure loss,"Loss terms oppose loop driving pressure and are modeled with dynamic-pressure basis q_i.","Do not interpret gross static pressure rise or recovery as local irreversible loss.",work_products/2026-07/2026-07-22/2026-07-22_thesis_latex_evidence_packet_ch7_ch8_results/claim_boundary_ledger.csv
SIGN-05,Component K,"K_i is an ordinary component coefficient only after component isolation, basis, recirculation, and UQ gates pass.","Negative apparent K or section-effective residual is not admitted component K.",reports/thesis_dossier/Chapters_and_sections/current/18_ch6_csem_closure_admission_uncertainty.md
SIGN-06,Upcomer velocity visuals,"U_y sign follows the rendered vertical/y-component convention in the figure package.","Use rendered downward Uy extrema as visual diagnostics only, not runtime inputs.",work_products/2026-07/2026-07-21/2026-07-21_velocity_magnitude_pictures/README.md
SIGN-07,Recirculation/exchange,"Exchange variables must state outward/inward and main/recirculating-zone basis.","Do not relabel source-side heat-flow as realized wallHeatFlux.",work_products/2026-07/2026-07-22/2026-07-22_thesis_latex_evidence_packet_ch7_ch8_results/result_status_matrix.csv
