priority,work_item,target_row,entry_condition,required_output,forbidden_action
1,S13 trusted exchange-interface and recirculation mask definition,TODO-S13-UPCOMER-EXCHANGE-SURFACE-VTK-EXTRACTION-2026-07-21,current geometry contract has 0 released interface rows,"exchange_interface_vtk, recirc_mask, normal vector provenance, interface area basis",do not substitute loop mdot planes or upcomer outlet proxy
2,S13 wall/core band and Q_wall_W source release,TODO-S13-UPCOMER-EXCHANGE-SURFACE-VTK-EXTRACTION-2026-07-21,recirculation mask exists,wall_vtk or wall/core band tied to recirculation region plus Q_wall_W sign convention,do not integrate wall heat on unlinked wall spans
3,S13 sampler manifest rerun,TODO-S13-UPCOMER-EXCHANGE-SAMPLER-MANIFEST-PREFLIGHT-2026-07-21,"interface, wall/core, normals, Q_wall_W, and source release exist",3/3 sampler-ready manifest rows or exact fail-closed blockers,do not launch harvest from manifest preflight alone
4,S13/S12 exchange QOI harvest and same-QOI UQ,TODO-THESIS-STUDY-S13-UPCOMER-EXCHANGE-PRODUCTION-HARVEST-UQ-2026-07-21,3/3 sampler-ready rows,"V_recirc, mdot_exchange, tau_recirc, wall/core state, pressure/energy residuals, same-QOI UQ",do not claim S11 until exactly one runtime-legal candidate passes all gates
5,S14 terminal low-recirculation pressure anchor refresh,separately claimed terminal/source readiness row,watched terminal cases land successfully,"finite endpoint fields, exact endpoint labels, RAF/RMF ordinary-flow checks, same-QOI UQ gap table","do not fit F6, component K, cluster K, clipped K, or global multiplier before UQ passes"
