blocker_id,severity,blocks_final_forward_v1,why_it_blocks,next_required_evidence,source_artifact
localized_h1_not_implemented,high,yes,"Current H1 rerun is an aggregate fixed-K proxy, not the ranked localized named-loss/reset bundle.",Fluid-side localized loss/reset support plus forward rerun showing mdot guardrail passes without thermal fitting.,work_products/2026-07/2026-07-13/2026-07-13_predictive_h1_proxy_rerun/README.md
h1_proxy_mdot_still_overpredicts,high,yes,"Every Salt2/3/4 H1 proxy row still overpredicts CFD mdot, even though the error is smaller.",Hydraulic scorecard acceptance threshold and residual attribution showing no systematic overprediction.,work_products/2026-07/2026-07-13/2026-07-13_predictive_h1_proxy_rerun/h1_proxy_results.csv
thermal_mesh_not_admitted,high,yes_for_thermal_closure_claims,Thermal gate reports zero fit-admissible rows and zero publication-ready thermal GCI rows.,"Admission gate that admits thermal rows after sign, heat-balance, downcomer, and mesh checks.",work_products/2026-07/2026-07-13/2026-07-13_thermal_mesh_gate/summary.json
predictive_hx_boundary_not_final,high,yes,Imposed cooler/HX1 proxy scores do not yet replace cooler duty with a fully predictive UA or epsilon-NTU boundary.,Frozen HX form trained only on allowed rows and scored on validation/holdout after hydraulic gate passes.,work_products/2026-07/2026-07-13/2026-07-13_predictive_external_bc_implementation_wave/hx_validation_guardrail_scorecard.csv
sensor_map_partial,medium,yes_for_complete_sensor_claim,TP2 and TW10 are blocked and the remaining coordinates are provisional diagnostics.,Survey-grade or explicit score-exclusion policy for blocked sensor labels.,work_products/2026-07/2026-07-13/2026-07-13_predictive_sensor_map_contract/summary.json
