target_id,type,source_path,target_chapter,caption_core,required_caveat,packet_use
FT-01,table,work_products/2026-07/2026-07-22/2026-07-22_thesis_evidence_packet_ch7_ch8_results_negative_blocked/result_status_matrix.csv,Chapter 7/8,Results status matrix for pressure thermal S13 model-form and final-score gates,Every row is diagnostic blocked or support unless admission_state says otherwise.,paper_outline_modeling_information
FT-02,table,work_products/2026-07/2026-07-22/2026-07-22_thesis_evidence_packet_ch7_ch8_results_negative_blocked/claim_boundary_ledger.csv,Chapter 7/8,Allowed and forbidden claims for current results,Use to prevent final-score and coefficient overclaims.,paper_outline_modeling_information
FT-03,figure,work_products/2026-07/2026-07-21/2026-07-21_velocity_magnitude_pictures/figures/velocity_magnitude_side_z_composite_labeled.png,Chapter 7,Matched Salt upcomer velocity-magnitude side-z composite,Diagnostic recirculation visual only; quantitative recirculation packet still needed.,paper_outline_modeling_information
FT-04,figure,work_products/2026-07/2026-07-22/2026-07-22_thesis_figtable_model_form_and_blocked_scorecard_panels/figures/svg/model_form_ladder_no_admission.svg,Chapter 7,Model-form ladder with no admission state,No final predictive model is admitted.,paper_outline_modeling_information
FT-05,figure,work_products/2026-07/2026-07-22/2026-07-22_thesis_figtable_model_form_and_blocked_scorecard_panels/figures/svg/blocked_scorecard_waterfall.svg,Chapter 8,Blocked scorecard gate waterfall,Final score values remain 0 until a frozen candidate exists.,paper_outline_modeling_information
FT-06,table,work_products/2026-07/2026-07-22/2026-07-22_thesis_master_model_form_scoreboard/master_model_form_scoreboard.csv,Chapter 7,Master model-form scoreboard,"Scoreboard is diagnostic/support and dispatch, not final admission.",paper_outline_modeling_information
FT-07,table,work_products/2026-07/2026-07-22/2026-07-22_four_study_thesis_support_gate/candidate_freeze_readiness_matrix.csv,Chapter 8,Candidate freeze readiness matrix,Decision is no_freeze_no_single_released_candidate.,paper_outline_modeling_information
FT-08,table,work_products/2026-07/2026-07-22/2026-07-22_s13_upcomer_exchange_target_plus_same_qoi_harvest/same_qoi_neighbor_triplet_matrix.csv,Chapter 7,S13 target/minus/plus same-QOI triplet readiness,Triplet-ready does not mean UQ executed or admitted.,paper_outline_modeling_information
