guardrail_id,applies_to,reason,required_label,forbidden_label_or_action,source_paths
no_pm5_ordinary_f6,F6_phi_Re; terminal_anchor_harvest,PM5 rows are material recirculation diagnostics with 0 ordinary scoreable rows.,diagnostic_recirculation_or_blocked_pending_terminal,ordinary_F6_fit,work_products/2026-07/2026-07-17/2026-07-17_research_studies_roadmap_and_today_start/study_priority_matrix.csv
no_universal_K_or_global_f,named_pressure_loss_or_reset_development_extraction,"LitRev supports named pressure basis, geometry, velocity basis, split, and UQ, not universal multipliers.",component_or_cluster_or_branch_apparent_with_basis,universal_K; hidden_global_friction_multiplier,work_products/2026-07/2026-07-13/2026-07-13_litrev_reset_named_losses/named_pressure_loss_table.csv
no_internal_Nu_heat_loss_absorption,branchwise_internal_HTC_bakeoff; wall_test_section_temperature_shape_candidate,"Jacket, passive, radiation, heater efficiency, wall/storage, and residual paths must stay separated.",heat_path_separated_or_blocked,internal_Nu_fit_absorbs_external_heat_loss,work_products/2026-07/2026-07-13/2026-07-13_litrev_heat_loss_calibration/heat_closure_admission.csv
recirculation_labels,CFD_reduction_validity_diagnostics; all closure tables,Material reverse or secondary flow invalidates single-stream ordinary coefficient names.,section_effective_or_diagnostic,ordinary_f_D_K_Nu_from_material_reverse_flow,work_products/2026-07/2026-07-13/2026-07-13_litrev_cfd_validity_diagnostics/coefficient_naming_limits.csv
runtime_legality,final_predictive_scorecard_or_thesis_claim,Predictive rows must not consume validation temperatures or realized CFD outputs at runtime.,runtime_input_audit_pass,realized_wallHeatFlux; CFD_mdot; imposed_cooler_duty; validation_temperature_runtime_input,work_products/2026-07/2026-07-17/2026-07-17_research_studies_roadmap_and_today_start/today_start_ledger.csv
