gate_id,candidate_id,gate,status,evidence,required_for_freeze,source_paths
PHASEF-G1,S12-HIAX1,legal_train_solve_metrics,pass,"Phase E train-only solve emitted finite mdot, pressure-root, TP, TW, and all-probe residual metrics.",yes,work_products/2026-07/2026-07-21/2026-07-21_fluid_external_bc_phase_e_train_full_solve/train_solve_summary.csv;work_products/2026-07/2026-07-21/2026-07-21_fluid_external_bc_phase_e_train_full_solve/thermal_residual_attribution.csv
PHASEF-G2,S12-HIAX1,s12_exchange_state_available,fail,"S12 still lacks V_recirc, mdot_exchange, tau_recirc, paired thermal state, pressure residual, and energy residual evidence.",yes,work_products/2026-07/2026-07-21/2026-07-21_thesis_study_s12_thermal_shape_ownership_candidate/admission_gate_matrix.csv
PHASEF-G3,S12-HIAX1,source_property_release,fail,"Architecture is source-backed but no source-bounded coefficient, property sensitivity, or split release exists.",yes,work_products/2026-07/2026-07-21/2026-07-21_thesis_study_s12_thermal_shape_ownership_candidate/source_property_label_table.csv
PHASEF-G4,S12-HIAX1,attribution_freeze_complete,fail,Prior attribution/freeze package has no frozen candidate and reports missing canonical coverage/full-solve/source-property gates.,yes,work_products/2026-07/2026-07-21/2026-07-21_train_only_external_bc_attribution_freeze_gate/candidate_freeze_gate.csv
PHASEF-G5,S12-HIAX1,validation_holdout_external_unconsumed,pass,"Phase E runtime audit consumed no validation, holdout, or external-test rows.",yes,work_products/2026-07/2026-07-21/2026-07-21_fluid_external_bc_phase_e_train_full_solve/runtime_leakage_audit.csv
