decision_id,scope,status,decision,basis,source_paths
D1,realized_CFD_wallHeatFlux_replay,allowed_diagnostic_only,"Use realized wallHeatFlux to locate heat-path mismatch, not as predictive runtime input.",CFD radiation is inseparable inside total wallHeatFlux; adding separate radiation would double-count.,operational_notes/maps/thermal-boundary-and-radiation.md;work_products/2026-07/2026-07-13/2026-07-13_thermal_boundary_patch_role_table/thermal_boundary_patch_role_table.csv;work_products/2026-07/2026-07-14/2026-07-14_best_predictive_heat_loss_discrepancy/best_predictive_leg_heat_loss_discrepancy.csv
D2,external_boundary_setup_parity,ready_for_setup_contract,Use h/Ta/Tsur/emissivity/layer metadata from the CFD boundary contract for parity/predictive setup modes.,AGENT-318 reports Fluid support for external_boundary_table fields; this package does not rerun Fluid.,work_products/2026-07/2026-07-13/2026-07-13_predictive_external_bc_implementation_wave/cfd_external_boundary_dictionary.csv;work_products/2026-07/2026-07-14/2026-07-14_fluid_api_localized_loss_external_bc_bridge/README.md
D3,radiation_off_runs,sensitivity_only,Do not call radiation-off 1D runs CFD parity.,The stale cfd-no-radiation-parity blocker is superseded; rcExternalTemperature includes emissivity/Tsur effects.,operational_notes/maps/thermal-boundary-and-radiation.md
D4,current_best_predictive_style_model,diagnostic_model_form_evidence,Use F1_heater_only for heat-loss placement diagnosis but not final predictive-HX validation.,The model still consumes imposed cooler duty and therefore is not setup-only predictive.,work_products/2026-07/2026-07-14/2026-07-14_best_predictive_heat_loss_discrepancy/best_predictive_leg_heat_loss_discrepancy.csv;operational_notes/maps/forward-predictive-model.md
D5,thermal_profile_internal_drive,not_admitted_for_closure_fit,"Treat wall-shell/wall-adjacent drive as a diagnostic next model until Salt2 train, Salt3 validation, Salt4 holdout gates are run.",Current wall-drive rows explain some over-loss behavior but do not constitute a validated internal Nu or HTC closure.,work_products/2026-07/2026-07-13/2026-07-13_wall_layer_drive_mapping/external_bc_drive_table.csv;work_products/2026-07/2026-07-14/2026-07-14_3d_1d_heat_loss_alignment/heat_loss_alignment_by_segment.csv
