priority,queue_item,target_rows,why,required_fields,acceptance_gate,unblocks,guardrail,source_paths
1,raw_two_tap_connector_and_component_repair,3,"Component/cluster rows are the nearest path to named K, but current K values are upper-bound/proxy or missing.",centerline_tap_length;final_pressure_basis;final_velocity_basis;straight_loss_subtraction;component_isolation;same_qoi_mesh_time_UQ,nonnegative local K after straight-loss subtraction with non-recirculating adjacent taps and explicit UQ,named component/cluster K scorecard against F3,do not admit universal K or proxy K_local rows,work_products/2026-07/2026-07-13/2026-07-13_litrev_reset_named_losses/named_pressure_loss_table.csv;work_products/2026-07/2026-07-17/2026-07-17_val_salt2_pressure_evidence_corner_k_diagnosis/corner_k_gate_matrix.csv
2,pressure_and_velocity_basis_finalization,18,Most current rows use pressure-ledger proxy bases; future score rows need explicit static/hydrostatic/kinetic/straight-loss accounting.,static_pressure_basis;hydrostatic_correction;kinetic_correction;velocity_basis;density_basis;units,basis fields are explicit and no buoyancy/kinetic term is double-counted,branch-apparent and straight-section f_D_delta_p review,do not score coefficients from ambiguous pressure basis,work_products/2026-07/2026-07-17/2026-07-17_litrev_gate_carryforward_ledger/target_package_gate_contract.csv;work_products/2026-07/2026-07-17/2026-07-17_predict_segment_pressure_models/pressure_evidence_rollup.csv
3,recirculation_mask_and_section_effective_policy,24,Recirculating rows cannot be ordinary f_D/K rows; they need low-reverse anchors or section-effective/onset labels.,RAF;RMF;SVF;coefficient_naming_limit;ordinary_vs_section_effective_label;steady_window,ordinary rows require RAF < 0.01 and RMF < 0.01; otherwise diagnostic/section-effective only,ordinary F6 gate or recirculation-mode pressure residual analysis,do not export ordinary f_D/K from material reverse-flow sections,work_products/2026-07/2026-07-17/2026-07-17_litrev_gate_carryforward_ledger/branch_gate_carryforward_summary.csv;work_products/2026-07/2026-07-17/2026-07-17_f6_litrev_hydraulic_model_form_ladder/hydraulic_model_form_ladder.csv
4,same_qoi_mesh_time_uncertainty_attachment,33,Current named pressure rows are coarse/diagnostic; admission needs same-QOI mesh/time uncertainty.,mesh_family;time_window;pressure_QOI;monotonicity_or_nonGCI_flag;uncertainty_bound,mesh/time uncertainty attached or row remains diagnostic,publication-grade pressure coefficient admission,"do not fabricate GCI for non-monotone, two-level, or unavailable data",work_products/2026-07/2026-07-17/2026-07-17_predict_segment_pressure_models/pressure_model_slot_admission.csv
5,reset_development_basis_to_Fluid_API_contract,all reset/development candidates,Reset distance is available but no runtime reset/development pressure API is admitted.,reset_type;L_over_D_from_reset;L_plus_or_development_metric;development_or_recovery_basis;property_mode,reset/development basis can be reproduced in a Fluid scorecard without hidden multiplier,faithful H1/reset-development pressure model implementation,do not assume fully developed flow solely from geometry,work_products/2026-07/2026-07-13/2026-07-13_litrev_reset_named_losses/reset_distance_map.csv;work_products/2026-07/2026-07-17/2026-07-17_f6_litrev_hydraulic_model_form_ladder/hydraulic_model_form_ladder.csv
