queue_id,blocker_id,required_evidence,minimum_acceptance,current_status,why_needed,source_path
f6:ordinary_nonrecirculating_pressure_rows,f6-friction-re-correction,Non-recirculating or low-reverse-flow pressure rows for upcomer/test-section-relevant spans.,"RAF < 0.01 and RMF < 0.01, valid same-window pressure loss, Re/Ri/property extraction, and split-safe scoring.",missing,Only these rows can support ordinary single-stream F6/f_D admission.,work_products/2026-07/2026-07-15/2026-07-15_f6_internal_nu_admission_review_and_forward_unblock/f6_fit_candidate_table.csv
f6:hybrid_pressure_residual_movement,f6-friction-re-correction,Explicit recirculation-modeled pressure residual movement against F3_shah_apparent.,"Validation/holdout improvement without realized CFD mdot, validation temperatures, or hidden global multiplier.",missing,Material-recirculation rows can only promote a named hybrid/onset lane if they move predictive residuals.,work_products/2026-07/2026-07-16/2026-07-16_recirc_feature_admission_and_hybrid_contract/hybrid_1d_model_contract.csv
f6:hybrid_thermal_geometry_features,f6-friction-re-correction,"Same-window wall-core or wall-bulk Delta T, Gz, RAF/RMF/SVF, and pressure metrics.",Features extracted on the same retained window and section definitions as the pressure/onset evidence.,partial,Current PM5 rows include RAF/RMF/SVF but lack the full hybrid feature set needed for admission.,work_products/2026-07/2026-07-16/2026-07-16_recirculation_cfd_anchor_study_design/required_output_contract.csv
f6:mesh_time_uncertainty,f6-friction-re-correction,"Mesh/time uncertainty for reverse-flow, Ri, pressure residual, and any admitted hybrid metric.",Coarse/medium/fine or documented time-window bounds before coefficient promotion.,missing,Prevents fitting an onset/friction correction to one under-bounded recirculation realization.,work_products/2026-07/2026-07-16/2026-07-16_recirculation_cfd_anchor_study_design/required_output_contract.csv
f6:cfd_anchor_follow_on,f6-friction-re-correction,Salt3 Q x insulation onset anchors from AGENT-478 after current Salt4 high-heat jobs are usable.,At least one low-reverse/non-recirculating anchor or bounded transition pair with required output contract.,blocked_pending_3299610_3299620_harvest_status,Current PM5 evidence is all material recirculation and cannot bracket onset alone.,work_products/2026-07/2026-07-16/2026-07-16_recirculation_cfd_anchor_study_design/proposed_cfd_run_matrix.csv
