run_id,status,command,result,mutated_protected_state,next_action
focused_forward_v1_unittest_suite,ran_passed,python3.11 -m unittest tools.analyze.test_forward_v1_hydraulic_unblock_plan_execution tools.analyze.test_forward_v1_next_step_execution_from_overnight tools.analyze.test_active_row_cleanup_and_forward_work_readiness tools.analyze.test_predictive_hx_fit tools.analyze.test_mdot_temperature_probe_error_audit tools.analyze.test_external_bc_thermal_profile_parity_study tools.analyze.test_heater_fraction_forward_v1_paper_methods tools.analyze.test_best_predictive_heat_loss_discrepancy tools.analyze.test_forward_v1_gate_refresh_after_fluid_api_and_audits,46 tests ran in 1.402 s; OK,false,Use as local validation evidence for current forward-v1 packages.
json_summary_validation,ran_passed,"python3.11 -m json.tool on AGENT-393, AGENT-394, AGENT-401, AGENT-402 summaries",All opened summary.json files parsed.,false,Keep summaries as source inputs for scorecard readiness.
read_only_scheduler_snapshot,ran_passed,"squeue and sacct read-only snapshots for 3293924, 3295438, 3295989-3295991, 3295901, 3295968, 3295120",3293924 and 3295120 running; 3295438 and AGENT-373 hydraulic chain pending; PM5 sbatch jobs cancelled.,false,Monitor only until terminal outputs exist; do not duplicate running/pending jobs.
sensor_map_policy_refresh,already_run_verified,AGENT-393 generated sensor_map_policy_refresh.csv,17 sensor rows available; TP/TW sensors are validation/scorecard only and runtime_input_allowed=false.,false,Consume as scorecard policy input after final gates land.
setup_only_hx_candidate_selection,already_run_verified,AGENT-402/AGENT-394 setup-only HX and cooler action tables,Best current candidate is salt2_fit_constant_UA_bulk_drive; leakage rows excluded.,false,"Use as candidate lane, not final predictive HX admission."
pm5_parser_repair,not_run_by_agent403_active_claim,AGENT-404 owns parser repair/reparse.,No AGENT-404 package outputs were present at AGENT-403 build time.,false,Wait for AGENT-404 closeout or claim a follow-up after it releases scope.
final_forward_v1_scorecard,not_run_blocked,No final scorecard run.,Final scorecard remains blocked by non-terminal hydraulics/cfd-pp and PM5 parser/onset evidence.,false,"Run only after admitted cfd-pp, hydraulics, BC/HX, and PM5/upcomer gates land."
