lane,workspace,role,allowed_paths,output_contract,may_run_in_parallel_with,stop_condition
latex-chapter-writer,papers,Writer,"One exact chapter or appendix .tex path plus papers status/journal","Updated LaTeX, guardrail/build result, no unsupported claims","Artifact producers and reviewers; other writers on different .tex files","Target .tex path already active under another board row"
artifact-producer,ethan_runs,Implementer/Tester/Writer,"Task-owned tools/analyze or tools/extract files; dated work_products package; status/journal/import","README with artifact_handoff_schema fields, generated CSV/PDF/SVG/PNG/table, validation command","All LaTeX writers, if not mutating LaTeX directly","Needs native-output mutation or unclaimed scheduler/solver action"
evidence-reviewer,ethan_runs or papers,Reviewer,"Read-only evidence/manuscript plus task-owned status/journal/review note","Claim-state review and allowed/forbidden-use notes","Artifact producers and LaTeX writers","Review requires changing claim state outside assigned scope"
latex-integrator,papers,Writer/Reviewer,"Exact .tex files plus figure/table copy paths if named","Imported completed artifacts, captions, labels, guardrail/build result","Artifact producers after package closeout","Artifact lacks split/admission/runtime-leakage fields"
coordinator,ethan_runs and papers,Coordinator,"Board rows, start-here notes, status/journal/import","Claimable task rows with exact paths and validation","All lanes","Conflicting ownership or unresolved policy decision"
