item_id,category,readiness,claim,evidence,key_number,limitations,next_action
geometry_provenance_mesh_centerlines,methods,paper_ready_methods_after_final_crosscheck,"The ROM should use mesh-derived geometry and station provenance, not schematic probe CSV endpoints, for loopwise closure extraction.",AGENT-162 mesh-centerline work; correctness validation geometry_reference.csv,90 geometry rows normalized,Endpoint/fitting stations remain excluded from straight-friction fits.,Keep mesh-centerline provenance in every pressure and thermal table.
pressure_friction_audit,postprocessing_correctness,meeting_ready_not_final_closure,`p_rgh` and section pressure gradients are now classified by physical role before use in the ROM.,work_products/2026-07-01_rom_postprocessing_correctness_validation/pressure_friction_audit.csv,36 pressure/friction rows; 6 direct-friction candidates; 12 buoyancy-contaminated apparent-resistance rows,Variable-density buoyancy decomposition is not implemented yet.,Add mechanical-loss balance before fitting Darcy f in heated/cooled legs.
thermal_htc_uaprime,thermal_closure,near_paper_ready_with_GCI_caveat,"HTC, UA', R', and Nu were extracted for Salt 2/3/4 mainline Jin continuations using OF13-reconstructed T.",reports/2026-06/2026-06-30/2026-06-30_claude_closure_results/README.md,lower-leg HTC 252/269/288 W/m2-K; upcomer Nu 3.11/4.06/4.99,Coarse mesh; sign convention and property-temperature review remain required.,Carry UA' as primary energy closure and Nu as diagnostic/correlation candidate.
upcomer_recirculation,buoyancy_flow_structure,meeting_ready_mechanism,The upcomer is not ordinary straight-pipe friction; it contains a buoyancy-driven recirculation/convection cell.,reports/2026-06/2026-06-30/2026-06-30_claude_closure_results/README.md,15-33 percent backflow; Ri >> 1,Only three current mainline points; perturbation runs are false-steady and not admitted.,Fit only after true-steady insulation/Q perturbations expand the operating range.
current_1d_validation,ROM_validation,meeting_ready_diagnostic,The defended June 23 1D scenario is useful but not yet predictive enough to present as final.,reports/2026-06/2026-06-23/2026-06-23_ethan_1d_closure_bakeoff/surface_summary.csv,best energy error 11.274319964365688 percent; mass-flow relative error 26.690955464130884 percent,CFD reference is latest-window/coarse-mesh; scenario form may be compensating errors.,"Score model forms against mdot, pressure distribution, heat balance, and sensor temperatures together."
local_hydraulic_replay,hydraulic_resistance,meeting_ready_diagnostic,Local hydraulic replay shows that resistance bookkeeping can match mdot only when the CFD drive is held fixed.,reports/2026-06/2026-06-29/2026-06-29_ethan_salt_pressure_drop_predictivity/local_hydraulic_replay_summary.csv,probe replay mean |mdot error| 0.00025483952391472695 kg/s; major-only 0.5539232734458288 kg/s; endpoint 0.48443225029948334 kg/s,Local replay is not a coupled predictive loop solve.,"Use it as a resistance sanity check, not as full ROM validation."
mesh_independence_gci,uncertainty,blocked,No mesh-independence uncertainty bound is currently available.,.agent/journal/2026-07-01/T6-mesh-independence-gci.md,single delivered mesh level only,External mesh generator is missing.,Obtain generator/refinement plan before claiming GCI bounds.
insulation_true_steady_runs,new_data,running_background,Two true-steady insulation variants are running under AGENT-164 and should expand closure support if they converge.,.agent/status/2026-07-01_AGENT-164.md,2 OF13 runs on interactive node c318-008,Do not touch active case directory; results not available yet.,Check run status tomorrow and admit only converged true-steady windows.
experimental_validation,future_validation,required_future_work,"A real predictive 1D model ultimately needs validation against experimental data, not only CFD replay.",reports/2026-07/2026-07-01/2026-07-01_presentation_readiness_and_rom_agenda/experimental_validation_next_steps.md,"planned, not yet executed",Requires measured uncertainties and sensor-to-model station mapping.,Prepare experiment-data contract and calibration/validation split.
