outline_area,current_ready_status,current_evidence_sources,missing_modeling_information,needed_study_or_packet,figures_tables_needed,allowed_writer_claim_now,forbidden_overclaim
motivation_and_contribution,ready_now,"work_products/2026-07/2026-07-22/2026-07-22_thesis_latex_evidence_packet_ch9_limits_sam/README.md; work_products/2026-07/2026-07-22/2026-07-22_thesis_outline_evidence_completeness_matrix/chapter_evidence_completeness_matrix.csv",Compact writer control surface still absent from LaTeX evidence,TODO-THESIS-LATEX-EVIDENCE-PACKET-WRITER-CONTROL-SURFACE-2026-07-22,"workflow figure; contribution table",Thesis contribution is a closure/admission workflow for CSEM/SAM-relevant 1D modeling with CFD reference evidence,Do not claim SAM validation or final predictive accuracy
CFD_evidence_database,ready_locally_needs_latex_import,"work_products/2026-07/2026-07-22/2026-07-22_thesis_ch3_cfd_provenance_qoi_compact_packet; work_products/2026-07/2026-07-22/2026-07-22_cfd_extraction_methodology_thesis_study/README.md",Compact packet not yet visible in thesis evidence directory,TODO-THESIS-LATEX-EVIDENCE-PACKET-CH3-CFD-DATABASE-2026-07-22,"case provenance table; retained-window table; QoI dictionary",CFD cases can be described by provenance window split role and legal-use labels,Do not call CFD-to-1D comparison experimental validation
1D_model_form_governing_equations,ready_imported_but_needs_outline_pack,"../papers/UTexas_Research/csem-Masters_dissertation/evidence/governing_equations_glossary; work_products/2026-07/2026-07-22/2026-07-22_thesis_master_model_form_scoreboard/README.md",Paper outline still needs a single model-slot inventory joining equations assumptions and status,TODO-THESIS-PAPER-OUTLINE-MODELING-INFORMATION-PACKET-2026-07-22,"model-slot inventory; symbol/unit table; runtime input whitelist/blacklist",Architecture can be described as fluid+walls segment model with pressure lane thermal lane wall stack source/sink slots and admission metadata,Do not imply model-slot definition equals closure admission
closure_admission_uncertainty,ready_needs_latest_imports,"work_products/2026-07/2026-07-22/2026-07-22_thesis_compact_numerical_claims_ledger; work_products/2026-07/2026-07-22/2026-07-22_thesis_source_property_release_unblock_study",LaTeX evidence should include latest source/property unblock and writer control surface,TODO-THESIS-LATEX-EVIDENCE-PACKET-SOURCE-PROPERTY-UNBLOCK-2026-07-22,"admission label table; source/property unblock table; runtime legality table",Closure admission is fail-closed and current source/property release-ready rows remain zero,Do not freeze a candidate or report protected scores
pressure_results_and_negative_findings,ready_locally_needs_latex_import,"work_products/2026-07/2026-07-22/2026-07-22_thesis_pressure_f6_ordinary_basis_failure_packet; work_products/2026-07/2026-07-22/2026-07-22_thesis_study_pressure_basis_ladder_evidence_packet",Pressure ordinary-basis failure packet not yet in thesis evidence directory,TODO-THESIS-LATEX-EVIDENCE-PACKET-PRESSURE-F6-ORDINARY-BASIS-2026-07-22,"pressure basis ladder; residual table; F6/component-K gate waterfall",Pressure work is a negative/non-admission result showing current basis and source-envelope failures,Do not admit component K F6 clipped K or hidden/global multipliers
thermal_results_residual_owner,partly_ready_waiting_visual_packet,"work_products/2026-07/2026-07-22/2026-07-22_thesis_study_thermal_accounting_traceability_evidence_packet; work_products/2026-07/2026-07-22/2026-07-22_thesis_study_thermal_tw_after_tp_residual_ownership",Need coherent visual sequence and final caption claim ledger,TODO-THESIS-THERMAL-RESIDUAL-OWNER-FIGURE-PACKET-2026-07-22,"residual-owner waterfall; heat-path/source-sink table; D2/D3/D4 RMSE table; passive hA sensitivity",Thermal findings can be framed as residual-owner separation before fitting,Do not absorb residual into internal Nu or release a global passive hA repair
upcomer_recirculation_and_single_stream_failure,ready_diagnostic_waiting_closed_fraction,"work_products/2026-07/2026-07-22/2026-07-22_thesis_study_recirculation_fraction_onset_evidence_packet; work_products/2026-07/2026-07-22/2026-07-22_thesis_s13_mesh_gci_upcomer_exchange_evidence_packet",Closed same-CV recirculation fraction not yet defensible,TODO-THESIS-RECIRCULATION-FRACTION-CLOSED-CV-STUDY-2026-07-22,"side-Z velocity panels; closed-CV mask schematic; Salt-family fraction table; topology table",Current evidence supports abandoning ordinary single-stream upcomer closure as admitted form,Do not claim closed recirculation fraction or admit upcomer Nu/f_D/K/F6/exchange coefficient
predictive_model_path,blocked_but_describable,"work_products/2026-07/2026-07-22/2026-07-22_thesis_master_model_form_scoreboard; work_products/2026-07/2026-07-22/2026-07-22_d2_source_bounded_projection_holdout_external_score_gate",Need one frozen runtime-legal candidate plus source/property release before final score,TODO-THESIS-STUDY-S15-CANDIDATE-FREEZE-SOURCE-PROPERTY-SCORE-RELEASE-2026-07-21,"blocked scorecard waterfall; candidate-freeze gate table",The predictive path and blocked score discipline can be described now,Do not report final predictive accuracy or validation score
sensor_and_projection_policy,active_packet_waiting,"work_products/2026-07/2026-07-22/2026-07-22_thesis_n4_sensor_qoi_projection_uncertainty_table; active TODO-THESIS-SENSOR-PROJECTION-APPENDIX-TABLE-PACKET-2026-07-22",Appendix-ready compact packet currently active,TODO-THESIS-SENSOR-PROJECTION-APPENDIX-TABLE-PACKET-2026-07-22,"sensor projection appendix table; uncertainty caveat table; runtime-temperature audit",Sensor targets are score-only and projection caveats can be stated,Do not use validation temperatures or sensor targets as runtime inputs
SAM_CSEM_relevance,ready_now,"../papers/UTexas_Research/csem-Masters_dissertation/evidence/ch09_limits_sam; reports/thesis_dossier/Chapters_and_sections/current/11_sam_facing_interpretation.md",Future SAM implementation remains outside current evidence,TODO-PAPER-FINAL-1D-MODEL-FORM-DOCS after shareable final results,"SAM transfer ledger; closure/admission workflow figure",SAM relevance is vetted closure metadata evidence mapping and fail-closed workflow,Do not claim SAM calibration validation or implementation

