asset_family,sensitivity_name,status,base_row_count,sensitivity_row_count,row_count_delta,base_model_status,sensitivity_model_status,base_log_re_slope,sensitivity_log_re_slope,log_re_slope_delta,base_rmse_log,sensitivity_rmse_log,qualitative_conclusion_changed,note
hydraulic_straight,direct_to_shear_gate_loose,run,12,12,0,fit,fit,-0.9477837868063631,-0.9477837868063631,0.0,0.035878677813696094,0.035878677813696094,no,Loose direct/shear ratio gate 0.40-2.50.
hydraulic_straight,direct_to_shear_gate_strict,run,12,6,-6,fit,fit,-0.9477837868063631,-0.9580925293037778,-0.010308742497414647,0.035878677813696094,0.028937066486927787,yes,Strict direct/shear ratio gate 0.67-1.50.
hydraulic_feature,feature_boundary_bin_count_2,run,16,16,0,fit,fit,1.5632483338754497,1.5854111932749602,0.02216285939951046,0.29129960116844295,0.27143976052790897,no,Feature local-boundary reference rebuilt with 2 nearest finite bins per side instead of 3.
hydraulic_feature,feature_boundary_bin_count_5,run,16,16,0,fit,fit,1.5632483338754497,1.7231107004302157,0.15986236655476604,0.29129960116844295,0.4309949782629115,no,Feature local-boundary reference rebuilt with 5 nearest finite bins per side instead of 3.
hydraulic,late_window_choice,not_run,12,12,0,fit,not_run,-0.9477837868063631,nan,nan,0.035878677813696094,nan,unknown,Hydraulic late-window sensitivity remains unrun because the straight-section defended rows are preserved only as case-level means in the additive dependency package.
thermal,closure_gate_loose,run,2,3,1,not_fit,fit,nan,0.9286431576416039,nan,nan,0.009334912124968486,yes,Thermal closure gate rebuilt with mean residual fraction <= 0.35.
thermal,closure_gate_strict,run,2,1,-1,not_fit,not_fit,nan,nan,nan,nan,nan,yes,Thermal closure gate rebuilt with mean residual fraction <= 0.20.
thermal,property_convention_case_probe,run,27,27,0,fit,fit,1.3412132361357063,1.2869297119865573,-0.054283524149149054,0.34120601080328106,0.34126983997435856,no,Case-probe property convention uses probe_T_avg_K rather than branch bulk temperature when deriving Re and Nu.
thermal,late_window_latest_time_only,run,27,27,0,fit,fit,1.3412132361357063,1.3415759633426338,0.0003627272069275378,0.34120601080328106,0.3412298097543375,no,Thermal target rebuilt from the latest retained time only instead of the retained-time case mean.
