property_item,current_label,affected_rows,permitted_use,blocked_use,reason,next_step,evidence_paths
jin_viscosity_parida_cp_santini_k,primary_property_mode,"Salt1-Salt4,PM5,PM10,val_salt2",diagnostic_and_gate_labeled_score_context,unqualified_fit_release,"Property mode is named and traceable, but source-envelope and material-closure sensitivity still block fit claims",Carry property mode into future row-specific envelopes,"work_products/2026-07/2026-07-20/2026-07-20_final_scorecard_source_envelope_resolution/scorecard_source_property_resolution_policy.csv"
property_sensitivity_material_closure_fit_blocked,fit_block_label,"Salt1 nominal and Salt2-Salt4 nominal",blocked_context_only,fit_and_model_selection,"Current rows cannot separate material closure sensitivity from source-envelope uncertainty",Require sensitivity-bounded release before coefficient fitting,"work_products/2026-07/2026-07-13/2026-07-13_litrev_property_sensitivity/property_sensitivity_summary.csv;work_products/2026-07/2026-07-20/2026-07-20_final_scorecard_source_envelope_resolution/scorecard_source_property_resolution_policy.csv"
property_sensitivity_material_closure_no_fit,no_fit_label,"PM5,PM10,val_salt2,diagnostic support rows",score_or_diagnostic_context_only,fit_and_model_selection,"Holdout, future, and external rows cannot tune material closure",Keep no-fit labels in any regenerated scorecard shell,"work_products/2026-07/2026-07-20/2026-07-20_final_scorecard_source_envelope_resolution/scorecard_source_property_resolution_policy.csv"
pm10_property_context,recirculation_diagnostic_only,PM10,recirculation_validation_only,runtime_input_or_fit,"PM10 parse repair supports validation use but does not release property-sensitive fitting",Use PM10 for recirculation diagnostic validation only,"work_products/2026-07/2026-07-20/2026-07-20_pm10_validation_repair_ledger/summary.json"
amx1_property_context,diagnostic_only,AMX1,smoke_and_comparison_diagnostics,fit_admission_and_model_selection,"AMX1 behavior and multiplier envelope are not ready for property-sensitive model selection",Resolve AMX1 form and multiplier envelope before any property-sensitive score grid,"work_products/2026-07/2026-07-20/2026-07-20_amx1_salt1_4_bounded_comparison_intake/summary.json;work_products/2026-07/2026-07-20/2026-07-20_amx1_localized_form_smoke_intake/summary.json"

