conclusion_id,finding,evidence,paper_claim_strength,limitation_or_blocker
C1_mainline_flow_temperature_ordering,"Across admitted Salt2/Salt3/Salt4 mainline rows, |mdot| rises from 0.013199343 to 0.017080866 kg/s as time-series probe temperature rises from 448.425 to 477.977 K.",n=3; Pearson r=0.999991; slope=0.000131371925 kg/s/K,observational monotonic trend; limited by n=3 and covarying boundary conditions,not a controlled flow-temperature law; Salt2 and Salt3 remain heat-drifting in steady labels
C2_power_temperature_boundary_confounding,"Initial temperature, probe temperature, heater power, cooler power, and external-h settings co-vary with the Salt case design.","heater trend n=3, r=0.999809; all-row external-h r=0.999094",valid as design documentation and context,do not interpret scalar correlations as independent causal coefficients
C3_boundary_heat_roles_scale_with_case,"Patch-role reductions show heater input, cooler removal, and passive heat losses increasing in magnitude from Salt2 to Salt4.",heater/cooler/ambient/test-section/junction wallHeatFlux roles are tabulated in patch_role_bc_summary.csv and plotted in bc_role_heat_breakdown_by_case.svg,usable for boundary-condition audit and qualitative heat-path explanation,"realized wallHeatFlux is a diagnostic outcome, not a predictive runtime input"
C4_old_q_perturbations_are_not_physical_response_rows,"Old Q perturbation rows are false-steady: observed mdot moves are 0.004-0.283%, well below expected 1.64-3.45% movement.",invalid_or_diagnostic_runs.csv and q_perturbation_expected_vs_observed_mdot_move.svg,strong exclusion/admission claim,none for exclusion; these rows remain provenance only
C5_corrected_pm5q_rows_are_sensitivity_evidence,"4 corrected +/-5Q rows are terminal-harvested and split-pending, with heat-role reductions now linked into this study.",corrected_q_pm5_response_overlay.csv; source AGENT-353 split-admission and heat-role tables,"usable as sensitivity/admission evidence, not independent fit rows","requires perturbation split policy, BC-role refresh, and operating-point/matched-plane gates before independent training or scoring use"
C6_radiation_semantics,"For current CFD rows, rcExternalTemperature includes radiation in total wallHeatFlux; no separate exported qr term exists.",bc_semantics_and_assumptions.csv; thermal-boundary-and-radiation map,required methods statement,do not double-count radiation or present a separate CFD qr heat-loss budget
