property_lane,current_candidate,current_status,release_decision_now,allowed_use_now,blocked_use_now,primary_blocker,next_required_gate
"baseline_property_family","jin_viscosity_parida_cp_santini_k","labels_complete_for_nominal_train_rows","sensitivity_only_no_final_release","Use as named provenance label in train/support diagnostics.","Do not freeze as final property package or use for protected scoring.","Nominal train release-ready rows are 0/4 and property sensitivity remains material-closure-fit blocked.","Candidate-specific property sensitivity and source-envelope strict pass."
"viscosity_mu","Jin viscosity family label","label_present_not_release_ready","sensitivity_only","Compute diagnostic Re/Pr sensitivity where velocity basis is legal.","Do not admit friction/Nu/F6 coefficients from it.","Viscosity/property mode release-ready false.","Release case/QOI property provenance with pressure/velocity basis."
"cp_J_kg_K","Parida cp family label","required_not_release_ready","blocked_required_input","Name cp as required for enthalpy, source integral, storage, and S13 exchange formulas.","Do not compute released source/property heat-path coefficients.","MF16 exact-field release-ready rows are zero.","Row-specific cp source path, property mode, split permission, and same-window QOI use."
"thermal_conductivity_k","Santini k family label","label_present_not_release_ready","sensitivity_only","Use in Pr and conduction-sensitivity bookkeeping.","Do not admit final Nu or wall-circuit coefficients from it.","Property package not candidate-specific released.","Candidate-specific k sensitivity and wall/material release gate."
"beta_from_density","density-derived beta rule","unresolved","unresolved","Use as planned buoyancy-coordinate lane only.","Do not admit Gr/Ra/Ri thresholds or mixed-convection switches.","Density/temperature-drive provenance and TAMU overlap calibration are incomplete.","Release beta rule with wall-bulk DeltaT, orientation, and same-QOI UQ."
"temperature_composition_guard","HITEC temperature and composition envelope","partially_labeled","guard_only","Require future property calls to report valid temperature/composition interval.","Do not extrapolate silently outside property-source envelope.","Strict source envelope and row-specific property validity not passed.","Publish row-specific temperature/composition validity table."
"freeze_margin","property uncertainty effect on candidate freeze","not_established","blocked","Use as a checklist item before freezing candidates.","Do not claim final freeze margin or score uncertainty.","No admitted property package or final candidate exists.","Run candidate-specific property perturbation before freeze."
