parameter_family,parameter_name,applies_to,initial_value,bounds_or_prior,training_rows_available,validation_rows_available,fit_status,rationale
external_hx,cooler_UA_multiplier_or_epsilon_NTU_parameter,cooler_branch_HX_boundary,1.0 after CFD duty parity calibration,"positive, low-dimensional, shared across Salt cases",3,0,highest_priority_next_fit_after heldout setup,P1 CFD cooler-duty replay reduces mean absolute Tmean error from 63.746 K to 4.456 K.
external_ambient,ambient_wall_h_multiplier,ambient_wall segments excluding cooler/heater/junction connectors,1.0,"positive, shared by segment role or global external environment",6,0,blocked_pending_clean_thermal_admission_and_uncertainty,"Segment external hA values are available, but wall flux includes inseparable rcExternalTemperature radiation."
external_radiation,rcExternalTemperature_effective_radiation_scale,rcExternalTemperature wall heat flux,fixed_1.0,do not separate until OpenFOAM emits a radiation ledger or a controlled rerun exists,0,0,blocked_inseparable_from_wallHeatFlux,AGENT-264 found emissivity/Tsur affect heat flux but no separate radiation output term is available.
internal_nu,global_internal_Nu_multiplier,pipe-flow Nu law in 1D thermal model,1.0,"positive, one global multiplier before segment-specific terms",0,0,blocked_pending_clean_thermal_admission_and_uncertainty,CFD Nu is a postprocessed effective quantity; current segment rows are mesh-unestablished or diagnostic.
internal_profile,thermal_development_or_profile_descriptor,lower_leg/upcomer/downcomer effective internal HTC trend,0.0 correction,low-dimensional monotone or sign-constrained descriptor,6,0,blocked_pending_clean_thermal_admission_and_uncertainty,High recirculation and reconstructed-T blockers prevent profile terms from being fit-safe now.
admission_gate,heldout_case_and_time_mesh_uncertainty_gate,all fitted thermal corrections,required,"no thesis-strength claim before heldout, time-window, and mesh uncertainty pass",0,0,required_before_predictive_claim,"Current control-volume statuses: fit=0, validation=6, diagnostic=6, blocked=3."
