rank,model_form,board_status_after_this_task,task_id,purpose,claim_boundary
1,M0 setup-only baseline,added_open_row,TODO-M0-SETUP-ONLY-BASELINE-PREDICTION-SCORECARD-2026-07-22,Produce the real lower-bound predictions or explicit missing-prediction matrix.,No final score unless predictions are generated under runtime-input audit.
2,M5 / MF-04 throughflow-plus-recirculation exchange cell,already_represented_by_S13_rows,TODO-THESIS-STUDY-S13-UPCOMER-EXCHANGE-PRODUCTION-HARVEST-UQ-2026-07-21,Unblock or fail-close production harvest for exchange CV QOIs.,"Diagnostic only until target-plus, same-QOI UQ, mesh/GCI, and source/property gates pass."
3,MF-02 section-effective pressure residual / pressure-mdot coupling,added_open_row,TODO-MF02-PRESSURE-MDOT-COUPLING-DIAGNOSTIC-2026-07-22,Quantify how pressure residual choices move mdot and thermal level.,"No component K, F6, clipped K, or hidden/global multiplier admission."
4,M2+ passive wall/test-section source-bounded repair,added_open_row,TODO-M2-PASSIVE-WALL-TEST-SECTION-SOURCE-BOUNDED-REPAIR-GATE-2026-07-22,"Separate broad cold bias into source-bounded passive heat, axial mixing, wall/core exchange, or unresolved residual.",No source/property release or repair execution unless independent source basis gates pass.
5,MF-01 ordinary gated single-stream branch,already_represented_by_S10_S14_and_future_F6_rows,TODO-S10-S14-PRESSURE-F6-CAND001-RETRY-AND-UQ-GATE-2026-07-21,Keep ordinary F6 limited to right_leg/test_section_span lanes after ordinary-flow and UQ gates.,No recirculating corner rows as ordinary F6 evidence.
