row_id,qoi_family,current_state,missing_evidence,phase,next_extraction_task,required_output_columns,paper_facing_use,source_paths
UQ-001,pressure,"Existing synthesis reviewed same-QOI rows; no pressure coefficient or F6 fit admitted.","Neighboring windows and accepted same-QOI mesh/GCI remain incomplete for pressure-corner and F6 pressure QOIs.",A/B/C,Build retained-window inventory then mesh/GCI matrix before any pressure admission review.,"qoi_name; pressure_basis; retained_time_source; neighbor_window_status; mesh_gci_status; admission_readiness; source_paths; next_task","Chapter 6 uncertainty table and Chapter 7 pressure caveat","work_products/2026-07/2026-07-21/2026-07-21_litrev_same_qoi_uq_execution/**; work_products/2026-07/2026-07-21/2026-07-21_pressure_corner_same_qoi_scientific_synthesis/**"
UQ-002,recirculation,"Matched-plane and upcomer exchange packages identify recirculation/exchange variables, but same-QOI UQ is not accepted.","Neighboring windows, terminal source readiness, and same-QOI mesh/GCI are not complete for V_recirc, mdot_exchange, and tau_recirc.",A/B/C,Inventory retained windows and terminal source status before sampler or UQ admission.,"qoi_name; case_family; retained_time_source; neighbor_window_status; terminal_source_status; mesh_gci_status; admission_readiness; source_paths; next_task","Chapter 6 recirculation uncertainty gate and Chapter 7 validity envelope","work_products/2026-07/2026-07-21/2026-07-21_heatloss_upcomer_exchange_evidence_extraction/**; work_products/2026-07/2026-07-21/2026-07-21_upcomer_exchange_terminal_source_readiness/**"
UQ-003,thermal,"Thermal row and mesh-gate evidence exists, but accepted same-QOI UQ is not complete across retained windows and mesh/GCI.","Neighboring-window drift and accepted same-QOI mesh/GCI remain unresolved for paper-facing thermal QOIs.",A/B/C,Join thermal rows to retained-window and mesh/GCI evidence without using residual heat terms as fit closure.,"qoi_name; thermal_role; retained_time_source; neighbor_window_status; mesh_gci_status; sign_policy_status; admission_readiness; source_paths; next_task","Chapter 6 thermal uncertainty and Chapter 7 heat-loss caveat","work_products/2026-07/2026-07-21/2026-07-21_litrev_same_qoi_uq_execution/**; thermal row/mesh gate packages cited there"
UQ-004,heat_loss,"Phase 5 frozen scorecard is negative and heat-loss exchange evidence remains blocked from final use.","Same-QOI heat-loss uncertainty lacks complete neighboring-window and accepted mesh/GCI support; upcomer exchange source evidence is not terminal-ready.",A/B/C,Separate external heat-loss terms, storage/source terms, and upcomer exchange rows before final uncertainty labels.,"qoi_name; heat_path; retained_time_source; neighbor_window_status; mesh_gci_status; source_term_status; admission_readiness; source_paths; next_task","Chapter 6 heat-loss uncertainty and Chapter 7 final scorecard limitations","work_products/2026-07/2026-07-21/2026-07-21_heatloss_phase_5_frozen_scorecard_and_thesis_handoff/**; work_products/2026-07/2026-07-21/2026-07-21_upcomer_exchange_terminal_source_readiness/**"
UQ-005,same-QOI admission,"The prior same-QOI execution package produced 83 reviewed rows and 0 admitted rows.","No consolidated successor table yet separates missing-window, missing-GCI, missing-source, and not-applicable reasons into a thesis-ready phase result.",C,Publish final same-QOI admission table after Phase A/B evidence joins.,"row_id; qoi_family; qoi_name; time_window_gate; mesh_gci_gate; source_gate; admission_readiness; blocked_reason; thesis_destination; source_paths","Chapter 6 admission table; thesis claim ledger update after separate row","work_products/2026-07/2026-07-21/2026-07-21_litrev_same_qoi_uq_execution/summary.json"
