candidate_id,property_family,property_lane,current_release_status,allowed_use_now,forbidden_use_now,primary_qoi_paths,blocker,next_gate
MF12_signed_source_memory_bulk_to_TP,jin_viscosity_parida_cp_santini_k,cp_J_kg_K,required_not_release_ready,train_support_algebraic_sensitivity_for_source_integral_and_storage,final_source_integral_or_protected_score_or_candidate_freeze,source_deltaT_1_over_mdot_cp;Pr;Gz;storage_heat_capacity,MF16 exact-field release-ready rows zero and strict source-envelope pass rows zero,row-specific cp source path property mode split permission same-window QOI use
MF12_signed_source_memory_bulk_to_TP,jin_viscosity_parida_cp_santini_k,viscosity_mu,labels_present_not_release_ready,train_support_Re_Pr_hydraulic_sensitivity,admitted_friction_Nu_F6_or_pressure_coefficients,Re;Pr;mdot_pressure_root_direction,nominal train release-ready rows zero and pressure endpoint readiness gated,candidate/QOI property provenance plus pressure velocity basis
MF12_signed_source_memory_bulk_to_TP,jin_viscosity_parida_cp_santini_k,thermal_conductivity_k,labels_present_not_release_ready,train_support_Pr_Gz_wall_resistance_sensitivity,admitted_wall_conduction_or_internal_Nu_coefficient,Pr;Gz;wall_layer_resistance,source/property release and material geometry release absent,candidate-specific k sensitivity with material geometry field completion
MF12_signed_source_memory_bulk_to_TP,jin_viscosity_parida_cp_santini_k,temperature_composition_envelope,partially_labeled_guard_only,require validity flag on every future property call,silent extrapolation outside HITEC source envelope,all property calls and nondimensional groups,strict row-specific source envelope failed closed,row-specific temperature/composition validity audit
MF12_signed_source_memory_bulk_to_TP,jin_viscosity_parida_cp_santini_k,beta_density_buoyancy_basis,unresolved,planned buoyancy-coordinate lane only,admitted Gr/Ra/Ri thresholds or mixed-convection switch,Gr;Ra;Ri;buoyancy_head,temperature drive and density/beta provenance incomplete,beta rule DeltaT basis orientation same-QOI UQ
