task_slug,role,objective,open_first_inputs,write_outputs,acceptance_signal,guardrails
litrev_fitting_inventory_and_source_envelope,"Implementer / Writer","Build TAMU fitting/corner/junction inventory and source-envelope status from geometry evidence plus LitRev rules","this package; reference/geometry_reference.md; current pressure maps; LitRev chapters/06 and data/schemas/minor_loss_table_schema.csv","work_products/<date>_litrev_fitting_inventory/** with fitting_inventory.csv and source_envelope_status.csv","every target fitting has geometry class, required missing fields, source status, and no unlabeled K","no native-output mutation; no coefficient admission; no source coefficients without geometry/basis"
pressure_corner_basis_recovery_audit,"Hydraulics / cfd-pp / Tester / Writer","For pressure-increasing corner candidates, decompose static, hydrostatic, kinetic, straight/developing, recovery, and residual terms","this package; two-tap endpoint harvest packages; pressure-and-momentum map; raw endpoint pressure/velocity rows","pressure_corner_basis_recovery_audit.csv and README","each corner row has coefficient_type and reason for component_K vs cluster_K vs diagnostic","no clipped K; no hidden global multiplier; no F6 fit"
recirculation_switching_calibration_template,"Hydraulics / Thermal-modeling / Writer","Define TAMU-specific calibration template for F_A/F_m/secondary/recovery thresholds without selecting final thresholds","this package; current recirculation packages; upcomer-onset map inputs; LitRev appendix S","switching_calibration_template.csv and next evidence list","definitions, training/held-out split requirements, and unresolved epsilon fields are explicit","do not import universal thresholds from literature; no admission change"
throughflow_recirc_exchange_cell_design,"Thermal-modeling / Hydraulics / Implementer / Writer","Design the reduced throughflow plus recirculation/exchange-cell model interface for persistent local exchange regions","this package; AGENT-467 hybrid contract; current upcomer/corner recirculation diagnostics","model_interface.md and dry schema for R_mu/R_rho/V_recirc/mdot_exchange/T_recirc","interface separates main stream, recirculation cell, exchange, pressure residual, and energy residual","design only unless a later row claims Fluid or code paths; no fitting/tuning"
CFD_postprocessing_schema_gap_audit,"cfd-pp / Tester / Writer","Compare current CFD postprocessing outputs against the LitRev contract and list missing fields by package/case","this package; AGENT-563 CFD readiness refresh; current pressure/heat audit packages","cfd_postprocessing_schema_gap_audit.csv and blocker-free next queue","each required CFD contract field is present, missing, or not applicable with cited package paths","read-only native outputs; no postprocessing launch"
thermal_heat_loss_contract_alignment,"Thermal-modeling / Writer","Align heat-transfer extraction and heat-loss resistance-network terms with existing external-boundary/predictive TODOs","this package; thermal-boundary map; thermal-closures map; external BC TODO row","thermal_contract_alignment.csv and map update","internal Nu, wall conduction, external convection, radiation, jacket, storage, and residual are separated","no Fluid edit unless a separate external row claims it; do not hide heat residual in Nu"
model_form_wave_dispatch,"Coordinator / Writer","Turn this extraction into separate board rows for pressure, recirculation, thermal, CFD schema, and Fluid/API implementation lanes","this package; current .agent/BOARD.md; generated STATE/BLOCKERS","board row proposals or active rows with non-overlapping scopes","each proposed row has owner, edit paths, read-only context, objective, acceptance, guardrails","avoid overlapping active claimed files; keep scheduler/native outputs read-only"
