owner_lane,evidence_package,positive_evidence,current_blocker,runtime_allowed_inputs,forbidden_inputs,owner_status,next_unlock
wall_core_exchange_shape,MF17 and D3,MF17 executed temporal same-QOI UQ for 4 QOI labels and D3 wall/core mechanism remains plausible,No Qwall production release mesh/GCI source/property release heat-flow match rows or coefficient admission,setup-known geometry and future released source/property fields,realized wallHeatFlux CFD mdot validation temperatures residual-fitted exchange coefficient,fail_closed_diagnostic_owner,complete same-label medium/fine sampler repair then post-sampler GCI/source-property gate
axial_mixing_wall_shape,D3,D3 reduces TW wall-index signed-error slope and transfer RMSE with diagnostic wall-shape signal,No independent axial-mixing coefficient same-QOI admission basis or runtime wall/profile operator,released geometry/source/property and admitted mixing operator,validation TW residual as runtime target or hidden Nu correction,fail_closed_diagnostic_owner,define source-bounded axial mixing candidate with independent UQ basis
source_placement,D4,D4 source-placement variants improve transfer RMSE by 3.03105262114 to 18.7328701562 K depending on mapped segment,Independent source/property or geometry release missing; empirical upper-bound only,setup-known source distribution after release,row-by-row residual source placement fit validation temperatures realized wall heat flux,fail_closed_empirical_upper_bound,release formula-local source placement kernel and row-specific properties
passive_boundary_external_loss,passive H2 and thermal accounting,Passive h/q estimates sit inside broad engineering screens and lane exists,0 passive source-family release-ready rows and missing ambient geometry insulation provenance,setup h_ext Ta Tsur emissivity area material/insulation labels if released,realized CFD wallHeatFlux legacy residual hA or validation TW temperatures,fail_closed_source_basis_missing,source-backed ambient/area/material/insulation preflight independent of wallHeatFlux
wall_conduction_material_stack,thermal accounting,Wall conduction lane exists and is physically separate from internal Nu,Current coupled candidates not final admitted and material/source labels incomplete,wall material thickness area k_wall solved wall state if released,fit multiplier absorbing external/radiation/storage residual,partial_diagnostic_not_admitted,release material stack and coupled score with split-safe candidate
sensor_qoi_projection,N4 and MF14,All TP/TW sensors have explicit post-solve score-target mappings and caveats,Runtime temperature allowed rows are zero and quantitative same-QOI projection UQ is not release-ready,none as runtime temperature input; post-solve score projection only,validation/holdout/external temperatures as runtime inputs,supporting_uncertainty_only,quantify projection uncertainty without promoting temperatures to inputs
storage_transient,thermal accounting,Storage is a named lane and may explain time-window drift in future transient work,Current model is steady and no solid-energy transient uncertainty is admitted,none in current steady model,storage used to tune steady fit or erase residual,not_current_runtime_model,open explicit transient model with rho cp volume and dTdt metadata
internal_Nu,thermal accounting,Internal Nu remains a valid internal convection lane with geometry/Re/Pr/Gz dependence,No evidence permits missing external/source/storage residual to be absorbed into Nu,geometry Re Pr Gz hydraulic diameter admitted wall-bulk drive,external heat residual passive loss radiation heater/cooler/storage residual CFD wallHeatFlux,not_residual_owner,only reopen through source-envelope Nu form and same-QOI labels
residual_unowned,thermal accounting and S12,S12 retains unresolved residual/stub lane and candidate-reviewable rows are zero,No single owner has independent runtime-legal release; residual is diagnostic only,none as closure,residual as fitted runtime heat path or internal Nu correction,active_blocker_owner_lane,keep residual explicit until one owner passes source/property and UQ gates
