queue_id,qoi_group,affected_rows,blocking_status,next_task,launch_required,guardrail,source_paths
SQOI-Q-001,pressure_delta/F6_endpoint,16,missing neighbor windows; Salt2 mesh spread diagnostic not GCI; RAF/RMF missing for ordinary gate,sample endpoint faces at retained plus neighboring windows and compute accepted same-QOI GCI where mesh triplets exist,yes only under a separate sampler row,no F6 fit or component-K admission,work_products/2026-07/2026-07-20/2026-07-20_f6_endpoint_pair_same_qoi_uq_preflight/endpoint_pair_pressure_deltas.csv;work_products/2026-07/2026-07-20/2026-07-20_f6_endpoint_face_uq_execution/same_qoi_mesh_uq.csv
SQOI-Q-002,component_or_section_K/pressure_recovery,6,current rows reverse-flow/section-effective; same-QOI UQ and recovery sweep missing,compute same-QOI UQ from existing endpoint faces first; queue recovery-plane sweep separately,no for existing endpoint UQ inventory; yes for new recovery sweep,preserve negative residual signs; no clipped K,work_products/2026-07/2026-07-18/2026-07-18_two_tap_same_qoi_uq_status/same_qoi_uncertainty_audit.csv;work_products/2026-07/2026-07-21/2026-07-21_litrev_pressure_corner_basis_recovery/pressure_corner_basis_recovery_audit.csv
SQOI-Q-003,HTC_Nu_heat_transfer,16,thermal rows are validation-only/blocked; publication GCI not admitted,"do not reopen internal Nu fitting until sign/enthalpy, residual-owner, recirculation, and same-QOI GCI gates pass",no from this row,do not absorb heat residual into internal Nu,work_products/2026-07/2026-07-16/2026-07-16_thermal_parity_resolution_gate/thermal_row_admission_gate.csv
SQOI-Q-004,heat_loss_network,10,contract labels exist but no numerical same-QOI heat-path UQ,feed split junction/storage/radiation extraction row before numerical heat-path UQ,no from this row,"heat-loss residual remains an owner/blocker pointer, not a closure",work_products/2026-07/2026-07-21/2026-07-21_litrev_thermal_heat_loss_contract_alignment/heat_loss_path_contract.csv
SQOI-Q-005,recirculation_metrics,6,retained face RAF/RMF/SVF exists only for current two-tap surfaces; no neighbor-window or mesh UQ,matched-plane recirculation harvest plus same-QOI time/mesh repeats,yes only for terminal-gated/future samplers,do not infer RMF/SVF from RAF proxies,work_products/2026-07/2026-07-20/2026-07-20_two_tap_face_qref_uq_progress/face_level_qref_flux_audit.csv
