step_id,order,action,open_first,completion_signal,notes
T001,1,Verify active board rows before claiming new work,.agent/BOARD.md,No overlap with AGENT-344/357/367/369/370/371 or other active scopes,"AGENT-370 may already cover heater-fraction work; avoid duplicate heater study."
T002,2,Open the AGENT-360 audit package README,work_products/2026-07/2026-07-14/2026-07-14_mdot_temperature_probe_error_audit/README.md,You know the generated file list and guardrails,"This is the canonical entry point for the mdot/probe audit."
T003,3,Read the paper-ready assessment,work_products/2026-07/2026-07-14/2026-07-14_mdot_temperature_probe_error_audit/paper_ready_report.md,You can state assumptions, modes, and principal results without chat logs,"Use this as prose seed, but keep diagnostic/predictive labels intact."
T004,4,Inspect trend conclusions,work_products/2026-07/2026-07-14/2026-07-14_mdot_temperature_probe_error_audit/trend_conclusion_register.csv,You can name the next blocker-moving study,"F002/F003/F004 are the highest-value next studies."
T005,5,Run focused tests before editing AGENT-360 code,tools/analyze/test_mdot_temperature_probe_error_audit.py,`python3.11 -m unittest tools.analyze.test_mdot_temperature_probe_error_audit` passes,"Do this before modifying the builder."
T006,6,Regenerate AGENT-360 only on compute node or when runtime is acceptable,tools/analyze/build_mdot_temperature_probe_error_audit.py,summary.json reports execute_fluid true and 12 executed model rows,"The full build invokes Fluid pressure-root solves and took several minutes."
T007,7,If launching overnight work, claim a new board row and write an output contract,.agent/BOARD.md,Board row names script, package, tests, and read-only paths,"Do not launch from this handoff row."
T008,8,Prefer ON-COOLER-SETUP or ON-TS-BOUNDARY for overnight,overnight_study_queue.csv,A new package exists with Salt2 train and Salt3/Salt4 score tables,"These address the strongest AGENT-360 blockers."
T009,9,If touching Salt1, keep it diagnostic until admitted,case_admission_and_use_table.csv,Salt1 rows remain diagnostic/context unless a separate admission gate changes status,"Salt1 lacks the consumed current patch heat ledger in AGENT-360."
T010,10,Close the task with status, journal, import manifest, and package README,AGENTS.md,Closeout paths exist and no generated index was modified unless claimed,"Follow repo continuity protocol."
T011,11,If running heavy CFD postprocessing, use Slurm or an allocated compute node,AGENTS.md,No long or expensive work ran on a login node,"Native CFD outputs remain read-only."
