canonical_leg_id,leg_role,candidate_rows,nu_candidate_rows,residual_owner_pass_rows,sign_heat_balance_pass_rows,recirculation_pass_rows,mesh_gci_pass_rows,fit_admissible_internal_nu_rows,branch_local_decision,primary_blockers,next_action,source_path
heater_lower_leg,source-region leg,7,2,6,0,0,0,0,blocked_source_sign_heat_balance_mesh,"source ownership, sign/heat-balance, and mesh/GCI still block fit","publish branch-local heater source/enthalpy/sign admission, then same-QOI Nu or HTC/UA mesh-GCI",work_products/2026-07/2026-07-16/2026-07-16_closure_qoi_mesh_gci_resolution/leg_specific_nu_model_form_matrix.csv
downcomer_right_vertical,non-source ordinary/developing leg,5,1,4,0,0,0,0,blocked_downcomer_policy_and_mesh,downcomer policy; sign/heat-balance; no admitted same-QOI GCI,write downcomer thermal policy and admit low-recirculation branch-local thermal rows before GCI,work_products/2026-07/2026-07-16/2026-07-16_closure_qoi_mesh_gci_resolution/leg_specific_nu_model_form_matrix.csv
cooler_hx_branch,HX/boundary leg,1,1,0,0,0,0,0,boundary_hx_lane_not_internal_nu_fit,HX/boundary residual not separable as internal Nu,keep setup-only UA/effectiveness model; fit cooler internal Nu only after HX removal and shell/boundary residual separation,work_products/2026-07/2026-07-16/2026-07-16_closure_qoi_mesh_gci_resolution/leg_specific_nu_model_form_matrix.csv
upcomer_left_vertical,recirculating upcomer including test section,35,27,6,0,0,0,0,hybrid_onset_diagnostic_not_single_stream,upcomer/test-section recirculation lane,classify onset as observed/bracketed/extrapolated or build explicit hybrid model; do not fit single-stream Nu,work_products/2026-07/2026-07-16/2026-07-16_closure_qoi_mesh_gci_resolution/leg_specific_nu_model_form_matrix.csv
junction_stub_connector,named local component,1,1,0,0,0,0,0,not_fit_target_or_manual_review,no current admitted fit path,manual review if this leg is intended for a future fit,work_products/2026-07/2026-07-16/2026-07-16_closure_qoi_mesh_gci_resolution/leg_specific_nu_model_form_matrix.csv
