metric_id,definition,current_basis,current_status,allowed_use,forbidden_use,next_required_evidence
reverse_candidate_fraction_of_right_leg_roi,reverse-candidate cells divided by right-leg ROI cells,cell-VTK topology proxy from fixed right-leg ROI,diagnostic_proxy_available,diagnostic onset/topology comparison,closed recirculation fraction or admitted coefficient,connected closed recirculation CV on same window with uncertainty
largest_component_fraction_of_reverse_candidates,largest connected reverse-candidate component divided by reverse-candidate cells,cell-VTK component proxy,diagnostic_proxy_available,fragmentation/topology diagnosis,claim single dominant recirculation cell,closed connected component definition and volume basis
largest_component_fraction_of_right_leg_roi,largest connected reverse-candidate component divided by right-leg ROI cells,cell-VTK component proxy,diagnostic_proxy_available,rough scale of dominant reverse region,closed recirculation volume fraction,same-window volume-weighted connected CV
RAF,reverse area fraction at a surface or endpoint,not populated for exact four-panel composite and not accepted for onset map,missing_for_exact_onset_map,gate ordinary/near-onset anchors after harvest,retrofit from rendered figures,same-source same-window surface extraction
RMF,reverse mass fraction at a surface or endpoint,not populated for exact four-panel composite and not accepted for onset map,missing_for_exact_onset_map,gate ordinary/near-onset anchors after harvest,ordinary closure fit without RMF pass,same-source rho U dot A extraction
V_recirc,volume of closed recirculation control volume,S13 current-coarse proxy exists but closed volume claim blocked,diagnostic_proxy_available_but_closed_claim_blocked,exchange residence proxy context,closed recirculation fraction admission,same-label medium/fine rows and closed-CV uncertainty
mdot_exchange,positive outward exchange mass-flow proxy,S13 current-coarse proxy exists,diagnostic_proxy_available,exchange strength/residence trend,exchange-cell coefficient admission,same-label mesh/GCI and production harvest
tau_recirc,V_recirc divided by positive exchange proxy,S13 current-coarse proxy exists,diagnostic_proxy_available,residence-time scale trend,admitted storage/exchange coefficient,same-label mesh/GCI and production harvest
Ri_same_cv,Richardson number on same window and same CV,not available in current packet,missing_blocks_onset_map,define required physics context,claim buoyancy/onset threshold,same-window same-CV beta g DeltaT L/U^2 basis with source/property labels
