model_form_id,expected_failure_modes,observed_failure_modes,blocker_linkage,source_paths
M0,large mdot/temperature residuals because setup-only model omits admitted losses and local roles,not yet run; prediction_missing,FINAL_FREEZE_TBD_not_created,work_products/2026-07/2026-07-17/2026-07-17_final_predictive_scorecard_shell/summary.json
M1,runtime leakage for predictive claims because realized CFD wall/patch heat is supplied,diagnostic replay has numeric legacy errors but is not predictive,runtime_leakage_by_design,work_products/2026-07/2026-07-16/2026-07-16_coupled_m3ts_test_section_scorecard/m2_m3_comparators.csv
M2,heater/cooler terms work while passive wall/test-section remains mislocalized,"PB1 static passive-total gate passes, but every PB1+cooler coupled candidate fails validation and holdout.",predictive-wall-test-section-submodels,work_products/2026-07/2026-07-16/2026-07-16_predictive_boundary_submodel_admission/submodel_admission_summary.csv;work_products/2026-07/2026-07-17/2026-07-17_wall_test_section_coupled_admission/static_component_scorecard.csv;work_products/2026-07/2026-07-17/2026-07-17_wall_test_section_coupled_admission/coupled_admission_review.csv
M3,"segment-only aggregation hides source placement, upcomer mixing, and junction/local losses","PB2/PB3 preserve passive-total heat and improve mdot, but all-probe and TW RMSE are far worse than M3.",local_wall_temperature_source_placement_or_upcomer_mixing_physics,work_products/2026-07/2026-07-17/2026-07-17_wall_test_section_distribution_ladder/coupled_delta_vs_m3.csv
M4,junction-aware lanes improve attribution but can overclaim if diagnostic corner-K is treated as admitted,"Corner K says 0 fit-admitted entries because every current corner row is diagnostic only: 12/12 local centerline K values are negative after straight-loss subtraction, 12/12 carry recirculation/coarse-no-GCI/component-isolation blockers, and the val_salt2 branch pressure rows themselves have 0 ordinary f_D/K fit-admitted entries.",pressure_corner_K_fit_admission_zero;junction_coefficient_admission_zero,work_products/2026-07/2026-07-17/2026-07-17_val_salt2_pressure_evidence_corner_k_diagnosis/summary.json;work_products/2026-07/2026-07-17/2026-07-17_val_salt2_external_score_and_unlock_progress/summary.json
