model_form_id,score_scope,score_status,mdot_error_pct,pressure_residual_movement,branch_heat_residual_W,loop_delta_T_error_K,tp_sensor_error_K,tw_sensor_error_K,all_probe_error_K,runtime_leakage_status,admission_status,score_interpretation,source_paths,branch_heat_residual_detail
M0,locked_split_shell,prediction_missing_not_run,,prediction_missing,,,,,,pass_contract_only,shell_only_lower_bound_not_scored,"M0 is thesis-safe as a required baseline contract, but no frozen predictions are available.",work_products/2026-07/2026-07-17/2026-07-17_final_predictive_scorecard_shell/summary.json,
M1,legacy_salt3_validation_salt4_holdout_not_locked_final_split,diagnostic_legacy_numeric_context_not_predictive,10.469,uses pressure-root replay; not valid as predictive pressure score,realized_CFD_thermal_replay_not_predictive,-1.817,25.5665,29.5605,28.293,diagnostic_leakage_by_design,diagnostic_not_admitted_predictive,Useful heat-placement/context replay; cannot be claimed as final predictive performance.,work_products/2026-07/2026-07-16/2026-07-16_coupled_m3ts_test_section_scorecard/m2_m3_comparators.csv,
M2,admitted_submodel_residuals_no_full_locked_split_score,partial_boundary_score_prediction_missing_for_full_model,,not_scored_full_model,7.50262,,,,,pass_for_admitted_heater_cooler_terms,heater_cooler_admitted_wall_test_section_blocked,"Heater/cooler boundary terms are admitted, but the complete predictive model is blocked by passive wall/test-section physics.",work_products/2026-07/2026-07-16/2026-07-16_predictive_boundary_submodel_admission/submodel_admission_summary.csv,heater:validation=0.4909731562 W;holdout=1.070245015 W | cooler_hx:validation=2.869104004 W;holdout=7.502618613 W
M3,legacy_salt3_validation_salt4_holdout_not_locked_final_split,legacy_numeric_context_final_prediction_missing,17.7415,segment pressure coefficients zero fit-admitted in final shell,passive/test-section residual blocker open,-2.5865,13.558,18.9775,17.36,pass_for_shell; legacy comparator not final locked split,blocked_freeze=FINAL_FREEZE_TBD_not_created;wall_blocker=local_wall_temperature_source_placement_or_upcomer_mixing_physics,M3 is the main comparison form but final scoring is blocked until an admitted Salt1-4 nominal freeze exists.,work_products/2026-07/2026-07-16/2026-07-16_coupled_m3ts_test_section_scorecard/m2_m3_comparators.csv;work_products/2026-07/2026-07-17/2026-07-17_final_predictive_scorecard_shell/summary.json;work_products/2026-07/2026-07-17/2026-07-17_wall_passive_test_section_admission_closeout/summary.json,
M4,junction_aware_diagnostic_targets_no_frozen_prediction,prediction_missing_diagnostic_junction_evidence_available,,corner_fit_admitted_rows=0;negative_K_rows=12,junction_rows=16;junction_coeff_admitted=0,,,,,pass_contract_diagnostic_sources_not_runtime_inputs,junction_heat_diagnostic_pressure_K_not_admitted,"M4 supports attribution/ownership claims, not an admitted predictive corner-K or junction coefficient claim.",work_products/2026-07/2026-07-17/2026-07-17_val_salt2_external_score_and_unlock_progress/summary.json;work_products/2026-07/2026-07-17/2026-07-17_val_salt2_pressure_evidence_corner_k_diagnosis/summary.json;reports/thesis_dossier/Chapters_and_sections/current/05_junction_aware_ledgers.md,
