gate_id,gate_group,required_before_final_scoring,gate_status,blocks_final_forward_v1,admitted_now,pending_from_agent,required_landing_artifact,pass_criteria,current_evidence,source_artifact,do_not_claim
input_contract_and_split,input_hygiene,yes,pass_locked,no,"strict input contract; salt_2=train, salt_3=validation, salt_4=holdout",none unless a documented split supersedes current split,documented split revision only if current split changes,"No runtime CFD mdot, realized CFD wallHeatFlux, or validation temperatures; no validation/holdout fitting.",Current split locked and admitted for forward-v0 scoring.,work_products/2026-07/2026-07-14/2026-07-14_forward_model_readiness_after_h1_proxy/train_validation_holdout_guardrail.csv,Do not revise the split after inspecting validation or holdout residuals.
hydraulic_localized_h1,hydraulics,yes,blocked_proxy_only,yes,H1 directional/proxy scorecard only,hydraulics / AGENT-318,Fluid localized named-loss/reset support plus rerun scorecard,"Localized H1 or successor hydraulic closure is implemented, not aggregate-only, and scored without thermal fitting.","Current H1 rerun is an aggregate fixed-K proxy, not the ranked localized named-loss/reset bundle.",work_products/2026-07/2026-07-14/2026-07-14_predictive_h1_hydraulic_scorecard/h1_hydraulic_scorecard.csv,Do not call aggregate fixed-K H1 a final localized closure.
hydraulic_mdot_bias,hydraulics,yes,blocked_positive_bias,yes,diagnostic/proxy mdot residual movement,hydraulics,hydraulic scorecard with mdot guardrail decision,"No systematic mdot overprediction on validation and holdout, or an explicit no-go decision.","Every Salt2/3/4 H1 proxy row still overpredicts CFD mdot, even though the error is smaller.",work_products/2026-07/2026-07-13/2026-07-13_predictive_h1_proxy_rerun/h1_proxy_results.csv,Do not tune thermal terms while mdot guardrail is unresolved.
thermal_internal_nu,thermal,yes_for_thermal_score,blocked_no_fit_rows,yes_for_thermal_closure_claims,validation-only or blocked thermal rows; no fit rows; baseline/literature/default internal Nu behavior only,internal-Nu / AGENT-319 plus cfd-pp onset candidates and therm-reconstr matched-plane extraction,"thermal admission/internal-Nu table with fit-admissible rows, cfd-pp onset candidates, and matched-plane thermal/vector extraction","Thermal rows pass sign, heat-balance, downcomer policy, recirculation, mesh/admission, cfd-pp onset-candidate, and matched-plane extraction checks.",thermal final gate has 0 fit rows and 5 blocked rows; upcomer recirculation gate has 0 fit-admissible internal-Nu rows,work_products/2026-07/2026-07-14/2026-07-14_thermal_admission_internal_nu_final_gate/summary.json,Do not consume fitted internal Nu rows or treat diagnostic thermal rows as final predictive closure evidence.
upcomer_section_effective_nu_diagnostic,thermal,yes_for_any_internal_nu_fit_reopen,diagnostic_validation_only_no_fit,yes_for_internal_nu_fit_reopen_no_for_default_predictive_run,Nu_section_effective_upcomer_diagnostic as diagnostic/validation-only evidence,cfd-pp onset candidates; therm-reconstr matched-plane extraction,internal_nu_dependency_blockers.csv dependencies resolved plus a later thermal admission gate admitting specific rows,"A later gate must show non-recirculating or transition anchors, matched vector/thermal planes, direct wall-bulk/core Delta T, Gz, mesh/time uncertainty, and terminal CFD admission.","3 upcomer diagnostic rows span Re=71.125-134.883, backflow=0.171875-0.277778; all remain recirculating",work_products/2026-07/2026-07-14/2026-07-14_upcomer_recirculation_internal_nu_admissibility/coefficient_naming_rules_for_recirculation.csv,"Do not rename this diagnostic coefficient as universal Nu, transferable Nu, or trainable internal-Nu closure data."
boundary_hx_wall_radiation,boundary_hx,yes,blocked_architecture_only,yes,architecture and guardrails only,BC-modeling / AGENT-318,setup-only boundary/HX model outputs and Fluid API evidence,Cooler/HX and external-boundary terms are setup-only and do not consume imposed CFD cooler duty as final evidence.,Imposed cooler/HX1 proxy scores do not yet replace cooler duty with a fully predictive UA or epsilon-NTU boundary.,work_products/2026-07/2026-07-14/2026-07-14_boundary_hx_wall_radiation_model_form_decision/decision_table.csv,Do not call imposed cooler duty or realized wallHeatFlux replay final predictive HX.
fluid_api_support,implementation,yes,partial_localized_k_only,yes,localized fixed-K hook only,BC-modeling / hydraulics / AGENT-318,Fluid support for localized H1 reset/redevelopment plus first-class external-boundary/HX dictionaries,Fluid can run the selected setup-only forward mode with declared localized losses and boundary inputs.,localized_fixed_k_hook_added=True; boundary_api_finalized=False; reset_redevelopment_implemented=False,work_products/2026-07/2026-07-14/2026-07-14_fluid_localized_h1_and_boundary_api/summary.json,Do not treat partial fixed-K hook as full external-boundary or reset/redevelopment support.
sensor_map_policy,sensors,yes_for_complete_sensor_score,partial_provisional_only,yes_for_complete_sensor_claim_no_for_partial_diagnostic_join,15 provisional diagnostic labels,sensor-map or scorecard owner,sensor exclusion or coordinate upgrade policy,TP/TW targets join after solve only; blocked labels are excluded or resolved.,"blocked sensors: TP2,TW10",work_products/2026-07/2026-07-13/2026-07-13_predictive_sensor_map_contract/summary.json,Do not use sensor temperatures as runtime inputs or sensor-wise corrections.
cfd_pp_admitted_training_data,cfd_admission,yes_if_expanding_training_data,blocked_pending_terminal_gate,no_for_current_salt234_split_yes_for_new_rows,0 corrected-Q rows,cfd-pp / AGENT-320,terminal corrected-Q or CFD admission inventory with BC labels and split eligibility,"Rows are terminal, admitted, source-labeled, BC-labeled, and explicitly assigned to train/validation/holdout or diagnostic-only.",job 3293924 state=RUNNING; terminal_or_post_exit_gate=False,work_products/2026-07/2026-07-14/2026-07-14_corrected_q_terminal_admission_gate/summary.json,Do not admit corrected-Q rows from live scheduler state alone.
