candidate_id,model_form,purpose,data_needed,fit_target,uncertainty_plan,priority
M1,buoyancy_corrected_mechanical_loss,Separate true wall/friction loss from `p_rgh` gradients and local buoyancy source terms.,"Section means, density/temperature profile, streamwise gravity projection, mesh centerlines.",Darcy f_D or excess f/f_lam for clean spans.,"Propagate station choice, pressure noise, mesh/GCI, and property uncertainty.",highest
M2,low_Re_bend_K_or_KRe,Represent compact-loop minor losses that are first-order at Re 60-135.,Bend/feature pressure budgets after corrected geometry.,"K, K/Re, or equivalent resistance per bend family.","Compare probe, mesh-centerline, and endpoint exclusions; bootstrap across cases.",high
M3,development_redevelopment_multiplier,"Capture entrance, bend-exit, and short-leg redevelopment losses beyond fully-developed laminar theory.","Branch development metrics, local Re, distance since feature.",f multiplier or additive pressure-loss term.,Gate by clean-station support and exclude fitting endpoints.,high
M4,UA_prime_constant_or_power_law,Use UA' directly as the ROM energy closure instead of overclaiming a universal Nu law.,"Lower-leg and upcomer HTC/UA' tables, q', T_wall, T_bulk.","UA'(Re), UA'(Ra), or segment-specific constant UA'.",Report parameter covariance and leave Pr collinearity explicit.,high
M5,upcomer_recirculation_onset,Replace upcomer friction with a mixed/natural-convection-cell closure.,"Backflow fraction, Ri/Ra/Gr/Re/Pr, true-steady insulation/Q variants.",recirculation strength or effective thermal/hydraulic resistance.,Do not admit false-steady perturbations; use censored/onset model if data remain sparse.,high_after_T2_results
M6,experiment_validated_uncertainty_layer,Move from CFD replay to real predictive credibility.,"Experimental mdot, powers, wall/fluid temperatures, ambient/insulation, geometry, uncertainty.","Prediction intervals for mdot, heat loss, and sensor temperatures.",Use calibration/validation split; do not tune and test on the same experiment.,future_required
