action_group,affected_cases,current_state,action_needed,priority,evidence_path,unlocks
live_corrected_q_job_3293924,salt2_lo10q;salt2_hi10q;salt4_lo10q;salt4_hi10q,RUNNING,"Wait for terminal scheduler state; do not launch an immediate duplicate harvest while the solver job is running. After exit, harvest stdout/stderr and solver logs, run operating-point steady/admission gate, and only then classify rows for fit/sensitivity use.",high,jadyn_runs/modern_runs/2026-07-04_corrected_salt_q_perturbations/slurm-saltq_sel_cont-3293924.out; jadyn_runs/modern_runs/2026-07-04_corrected_salt_q_perturbations/slurm-saltq_sel_cont-3293924.err; jadyn_runs/modern_runs/2026-07-04_corrected_salt_q_perturbations/logs/selected_runtime_preflight_3293924.csv,potential corrected-Q sensitivity/correlation rows; no downstream use until admitted
deferred_corrected_q_partial_rows,salt2_lo5q;salt2_hi5q;salt3_lo10q;salt3_lo5q;salt4_lo5q;salt4_hi5q,stopped/under-advanced,Continue or re-gate rows after sufficient perturbed operating-point window; retain as sensitivity-only unless split policy admits perturbations.,medium,work_products/2026-07/2026-07-13/2026-07-13_corrected_q_latest_time_refresh/all_corrected_q_status_table.csv,possible Q-response diagnostics after terminal harvest
failed_corrected_q_high_rows,salt3_hi5q;salt3_hi10q,failed/not accepted,Investigate cancelled high-Q attempt before rebuild/rerun; document launcher/BC/log cause.,medium,work_products/2026-07/2026-07-13/2026-07-13_corrected_q_latest_time_refresh/all_corrected_q_status_table.csv,Salt3 high-Q sensitivity rows only after corrected rerun and terminal gate
salt1_policy,salt1_jin_nominal_continuation;salt1_lo10q;salt1_hi10q,terminal/context-only,Write and approve Salt1 admission/split policy; verify corrected-Q convergenceMonitor cannot stop on weak diagnostic criteria before any continuation.,medium,work_products/2026-07/2026-07-13/2026-07-13_salt1_terminal_harvest_admission_review/admission_decision_table.csv,Salt1 diagnostic context only unless policy changes
mesh_family_closure_qoi_gci,salt2_mesh_refinement_family_coarse_medium_fine,diagnostic only,Resolve non-monotone/missing-triplet/sign/heat-balance blockers before any closure-fit or publication uncertainty use.,high,work_products/2026-07/2026-07-14/2026-07-14_thermal_closure_mesh_gate_refresh/refreshed_qoi_mesh_gate_status.csv,publication-strength mesh uncertainty and thermal/closure admission
bc_labeling_for_pending_rows,all corrected-Q rows after terminal harvest,manifest/preflight labels only,Reduce row-level boundary patch roles and heat ledgers after terminal postprocessing; preserve rcExternalTemperature radiation semantics.,medium,jadyn_runs/modern_runs/2026-07-04_corrected_salt_q_perturbations/corrected_case_manifest.csv; operational_notes/maps/thermal-boundary-and-radiation.md,correctly labeled sensitivity rows for downstream tables
upcomer_onset_bracketing,salt2_jin_nominal_continuation;salt3_jin_nominal_continuation;salt4_jin_nominal_continuation;salt4_hi5q;salt4_hi10q;new_targeted_re150;new_targeted_re200;new_targeted_re250,existing admitted diagnostics reach Re_upcomer=134.883 and all are recirculating,"Mine terminal Salt4 high-Q corrected rows after job 3293924 exits; if no admitted row reaches a transition/non-recirculating state, design targeted Salt CFD at Re_upcomer 150, 200, and 250 with matched recirculation, wall-bulk Delta T, Gz, secondary-velocity, and uncertainty extraction.",high,work_products/2026-07/2026-07-14/2026-07-14_upcomer_recirculation_internal_nu_admissibility/upcomer_recirculation_onset_conditions.csv; work_products/2026-07/2026-07-14/2026-07-14_upcomer_onset_blocker_resolution/next_evidence_requirements.csv; work_products/2026-07/2026-07-14/2026-07-14_upcomer_recirculation_internal_nu_admissibility/blocked_missing_metrics.csv,bounded upcomer recirculation onset and ordinary-pipe anchor evidence
