candidate_physics,f2_global_affine_explanation,f5_family_offset_explanation,supporting_evidence,blocking_evidence,attribution_strength,admissible_as_physical_closure
MF07_entrance_development_reset,plausible broad global/axial development bias source,weak family-specific support because recirculation blocks many single-stream spans,D2 thermal path promising; MF07 decision diagnostic_only; thermal-development rows 33,MF07 smoke-ready False; recirculation-blocked rows 60; source/property release False,plausible_diagnostic_not_released,False
MF08_signed_wall_flux_development,plausible because loop-wide heating/cooling sign errors can create global affine temperature bias,stronger shape match because F5 has thermal-family offsets and signed branch heat is family-specific,MF08 decision needs_source_basis_sign_aware_development_promising_diagnostic_only; sign-envelope rows 4; needs-source-basis rows 4,setup Q signs are not source/property release; realized wallHeatFlux runtime input is forbidden,strongest_physical_hypothesis_diagnostic_only,False
MF09_recirculating_upcomer_exchange_stratification,partial support for global bias through unresolved exchange/storage in recirculating upcomer,plausible upcomer/family-specific support but not smoke-ready,MF09 best lane MF09b_throughflow_plus_recirculation_exchange_cell_with_signed_wall_heat; variants 4,MF09 decision blocked_missing_mesh_gci_source_basis; smoke-ready 0; accepted mesh/GCI QOIs 0,plausible_but_blocked_missing_mesh_gci_source_basis,False
D3_wall_shape_axial_mixing,limited because F2 is global and cannot represent local wall shape after bias,plausible contributor to F5 thermal-family offsets,D3 transfer RMSE reduction 51.6919381995%; local-shape RMSE 7.93285020379 K,D3 candidate-ready rows 0; same-QOI UQ executed False,diagnostic_shape_support_only,False
D4_segment_source_placement,partial support if source placement creates global cold bias,strong support for family/segment offset interpretation,D4 transfer RMSE reduction 54.272279139%; target segments 4,D4 source-bounded candidate-ready rows 0; admission fail_closed_not_admitted,strong_empirical_upper_bound_not_source_bounded,False
sensor_QOI_projection,possible offset/scale contributor if mapped sensors/QOIs are not one-to-one runtime observables,weak to moderate support because sensor families can imitate thermal-family offsets,N4 bounded rows 15; sensor rows 17,N4 runtime temperature allowed rows 0; source/property release False,projection_uncertainty_context_only,False
